"[]","None","None","False","None","Hunncas","None","None","[]","None","None","None","text","t2_h32ie","False","False","False","[]","None","None","I called the guy from the ""Bummed for Burgling"" meme.   
What he did to the group of thugs that were going to rob my character left me gasping for air from so much laugh. I'd share the sreenshot had I not deleted the adventure a while ago.","True","False","False","None","None","None","None","0","1687292158.0","2023-06-20-221558","1687292158.0","None","0","False","0","joviym2","False","None","t3_14ekav3","False","None","None","None","[]","t1_joviym2","False","0","t3_14ekav3","/r/AIDungeon/comments/14ekav3/this_is_the_best_thing_ive_read_all_day_for_some/joviym2/","None","","[]","1687292189","False","10","False","True","False","AIDungeon","t5_29uaei","r/AIDungeon","public","None","0","[]","None","1693266627","10","[]",""
"[]","None","None","False","None","-Recursive","None","None","[]","None","None","None","text","t2_vzsf4e77","False","False","False","[]","None","None","I've never actually \\*tried\\* to do it, but the AI does it on its own for me sometimes, here's how. There's definitely people more qualified than me to explain it but I'll try lol (some people are wizards with world info, memory, author's note, etc. it's insane!) Hopefully one of them can give you some super good advice.

You can get the AI to generate multiple options for you in a simple manner by doing something like this: use story or edit your last action and write something similar to ""here are your choices for the next action"", go down a line and put in a 1, and the AI has a maybe 50-75% chance of generating a list of choices.   
After that, in order to pick the option you want to, just typing in the number won't work as the AI won't understand that. You'll have to re-type the option you want, and then repeat everything over again for the next choice area.

Again, probably not the best way to go about things, but it works. I don't know how well it will remember the past parts of your story as well since you're swapping from it to a list of things to do next.","True","False","False","None","None","None","None","0","1687295668.0","2023-06-20-231428","1687295668.0","None","0","False","0","jovrybu","False","None","t3_14emo8f","False","None","None","None","[]","t1_jovrybu","True","0","t3_14emo8f","/r/AIDungeon/comments/14emo8f/question/jovrybu/","None","","[]","1687295699","False","3","False","True","False","AIDungeon","t5_29uaei","r/AIDungeon","public","None","0","[]","None","1693268449","3","[]",""
"[]","None","None","False","None","Bolba366","None","None","[]","None","None","None","text","t2_kmi076nx","False","False","False","[]","None","None","Yeah I’ve had the AI do something similar on accident and that’s what made me curious if I could just artificially make it happen all the time.  I did have a world where using the story input I just copied and pasted a prompt like “here are your options adventurer” and that gave me something similar to what I wanted but I was curious if there was something less labor intensive!","True","False","False","None","None","None","None","0","1687296000.0","2023-06-20-232000","1687296000.0","None","0","False","0","jovsrjh","True","None","t3_14emo8f","False","None","None","None","[]","t1_jovsrjh","True","0","t1_jovrybu","/r/AIDungeon/comments/14emo8f/question/jovsrjh/","None","","[]","1687296031","False","2","False","True","False","AIDungeon","t5_29uaei","r/AIDungeon","public","None","0","[]","None","1693268621","2","[]",""
"[]","None","None","False","None","-Recursive","None","None","[]","None","None","None","text","t2_vzsf4e77","False","False","False","[]","None","None","Yeah, I'm pretty sure it is possible. I played one scenario that was a dungeon crawler with randomly generated floors, loot, enemies, and encounters every five or so actions; I don't think it would be too far fetched to make it generate a list of options. Hopefully someone AI savvy can make a scenario with that!","True","False","False","None","None","None","None","0","1687296444.0","2023-06-20-232724","1687296444.0","None","0","False","0","jovtudt","False","None","t3_14emo8f","False","None","None","None","[]","t1_jovtudt","True","0","t1_jovsrjh","/r/AIDungeon/comments/14emo8f/question/jovtudt/","None","","[]","1687296475","False","3","False","True","False","AIDungeon","t5_29uaei","r/AIDungeon","public","None","0","[]","None","1693268838","3","[]",""
"[]","None","None","False","None","RiftHunter4","None","None","[]","None","None","None","text","t2_2r3fzc3l","False","False","False","[]","None","None","Is there a particular behavior the Ai is doing to ruin the story?","True","False","False","None","None","None","None","0","1687302573.0","2023-06-21-010933","1687302573.0","None","0","False","0","jow7sur","False","None","t3_14eo5ag","False","None","None","None","[]","t1_jow7sur","True","0","t3_14eo5ag","/r/AIDungeon/comments/14eo5ag/how_do_you_get_the_ai_to_make_a_sensible_story/jow7sur/","None","","[]","1687302604","False","2","False","True","False","AIDungeon","t5_29uaei","r/AIDungeon","public","None","0","[]","None","1693271682","2","[]",""
"[]","None","None","False","None","_and_red_all_over","None","None","[]","None","None","None","text","t2_p1c0zepi","False","False","False","[]","None","None","What happens next? 

Do: Stop giving Latitiude money. 

You stop giving Latitiude money for a broken AI game. They have less money for development and maintenance. The game gets worse. More people end their subscriptions because they don't want to play a broken AI game. The game gets worse. You stop playing for several months, because the free version is awful.

 Do you: 

A: Return in a few months to see if it has improved?

B: Find an alternative?","True","False","False","None","None","None","None","0","1687305470.0","2023-06-21-015750","1687305470.0","None","0","False","0","jowe0yj","False","None","t3_14edmu1","False","None","None","None","[]","t1_jowe0yj","False","0","t3_14edmu1","/r/AIDungeon/comments/14edmu1/ai_dungeon_error/jowe0yj/","None","","[]","1687305500","False","1","False","True","False","AIDungeon","t5_29uaei","r/AIDungeon","public","None","0","[]","None","1693272916","1","[]",""
"[]","None","None","False","None","SnooHesitations3114","None","None","[]","None","None","None","text","t2_76s5vpmo","False","False","False","[]","None","None","You're talking preemptive measures against all possible zombies.  
You may not have been bitten yet, but it's only a matter of time before you join the zombie hoard.  
Got to get a bit of practice in stabbing yourself so you can take yourself out when you eventually do become a zombie.  
Too many people fail to practice, so they end up as maimed zombies with obvious knife wounds.  
You either do the job properly, or not at all.  
Those who mess it up become disabled zombies, and no one wants to be a disabled zombie.","True","False","False","None","None","None","None","0","1687306522.0","2023-06-21-021522","1687306522.0","None","0","False","0","jowg8il","False","None","t3_14de8yy","False","None","None","None","[]","t1_jowg8il","False","0","t3_14de8yy","/r/AIDungeon/comments/14de8yy/well_this_stinks/jowg8il/","None","","[]","1687306553","False","3","False","True","False","AIDungeon","t5_29uaei","r/AIDungeon","public","None","0","[]","None","1693273349","3","[]",""
"[]","None","None","False","None","TheSigmaOne","None","None","[]","None","None","None","text","t2_s0no62mr","False","False","False","[]","None","None","Based Dungeon","True","False","False","None","None","None","None","0","1687309043.0","2023-06-21-025723","1687309043.0","None","0","False","0","jowliqy","False","None","t3_14ekav3","False","None","None","None","[]","t1_jowliqy","False","0","t3_14ekav3","/r/AIDungeon/comments/14ekav3/this_is_the_best_thing_ive_read_all_day_for_some/jowliqy/","None","","[]","1687315501","False","5","False","True","False","AIDungeon","t5_29uaei","r/AIDungeon","public","None","0","[]","None","1693274388","5","[]",""
"[]","None","None","False","None","Top_Complaint5211","","None","[]","None","None","dark","text","t2_c47qctnj","False","False","False","[]","None","None","And example of what I would want would be like:

Hi I'm the person you are texting.
> Wow this is cool
What are you doing.
> Just walking.
Nice

Ect","True","False","False","None","None","None","None","0","1687335201.0","2023-06-21-101321","1687335201.0","None","0","False","0","joxqkwo","True","None","t3_14f1iqi","False","None","None","None","[]","t1_joxqkwo","True","0","t3_14f1iqi","/r/AIDungeon/comments/14f1iqi/how_to_make_it_act_like_i_a_chatroom/joxqkwo/","None","","[]","1687335233","False","1","False","True","False","AIDungeon","t5_29uaei","r/AIDungeon","public","None","0","[]","None","1693282247","1","[]",""
"[]","None","None","False","None","Top_Complaint5211","None","None","[]","None","None","None","text","t2_c47qctnj","False","False","False","[]","None","None","Epic banger. It's rapping lol","True","False","False","None","None","None","None","0","1687335477.0","2023-06-21-101757","1687335477.0","None","0","False","0","joxqwdb","False","None","t3_14enx22","False","None","None","None","[]","t1_joxqwdb","False","0","t3_14enx22","/r/AIDungeon/comments/14enx22/when_the_ai_loses_sanity/joxqwdb/","None","","[]","1687335507","False","5","False","True","False","AIDungeon","t5_29uaei","r/AIDungeon","public","None","0","[]","None","1693282306","5","[]",""
"[]","None","None","False","None","Top_Complaint5211","None","None","[]","None","None","None","text","t2_c47qctnj","False","False","False","[]","None","None","Whattt is that the AI Dungeon images? I never seen it before. That's so cool","True","False","False","None","None","None","None","0","1687335552.0","2023-06-21-101912","1687335552.0","None","0","False","0","joxqzho","False","None","t3_14eerss","False","None","None","None","[]","t1_joxqzho","True","0","t3_14eerss","/r/AIDungeon/comments/14eerss/the_creature_creaches_at_me_fiercefully/joxqzho/","None","","[]","1687335584","False","1","False","True","False","AIDungeon","t5_29uaei","r/AIDungeon","public","None","0","[]","None","1693282319","1","[]",""
"[]","None","None","False","None","Top_Complaint5211","None","None","[]","None","None","None","text","t2_c47qctnj","False","False","False","[]","None","None","Hot lol","True","False","False","None","None","None","None","0","1687335858.0","2023-06-21-102418","1687335858.0","None","0","False","0","joxrcho","False","None","t3_14bmr1i","False","None","None","None","[]","t1_joxrcho","True","0","t3_14bmr1i","/r/AIDungeon/comments/14bmr1i/tracking_collars_on_my_balls/joxrcho/","None","","[]","1687335889","False","1","False","True","False","AIDungeon","t5_29uaei","r/AIDungeon","public","None","0","[]","None","1693282388","1","[]",""
"[]","None","None","False","None","Traditional-Fix448","None","None","[]","None","None","None","text","t2_vuynscm8","False","False","False","[]","None","None","I think you should check out character.ai","True","False","False","None","None","None","None","0","1687344740.0","2023-06-21-125220","1687344740.0","None","0","False","0","joy271n","False","None","t3_14f1iqi","False","None","None","None","[]","t1_joy271n","False","0","t3_14f1iqi","/r/AIDungeon/comments/14f1iqi/how_to_make_it_act_like_i_a_chatroom/joy271n/","None","","[]","1687344772","False","5","False","True","False","AIDungeon","t5_29uaei","r/AIDungeon","public","None","0","[]","None","1693284367","5","[]",""
"[]","None","None","False","None","ccaarr123","None","None","[]","None","None","None","text","t2_nhzo7","False","False","False","[]","None","None","Ive made a post about my twitch chat ai bot which  works similar to what ur saying, you can create a character and backstory and it will generate dialog and story based on what you wrote PS. its still a work in progress","True","False","False","None","None","None","None","0","1687345547.0","2023-06-21-130547","1687345547.0","None","0","1687345986.0","0","joy3e0g","False","None","t3_14f1iqi","False","None","None","None","[]","t1_joy3e0g","True","0","t3_14f1iqi","/r/AIDungeon/comments/14f1iqi/how_to_make_it_act_like_i_a_chatroom/joy3e0g/","None","","[]","1687345578","False","2","False","True","False","AIDungeon","t5_29uaei","r/AIDungeon","public","None","0","[]","None","1693284577","2","[]",""
"[]","None","None","False","None","Top_Complaint5211","None","None","[]","None","None","None","text","t2_c47qctnj","False","False","False","[]","None","None","I guess this is cool but I was looking for something that I could have more freedom with like nsfw sorry i guess i should have said that","True","False","False","None","None","None","None","0","1687350525.0","2023-06-21-142845","1687350525.0","None","0","False","0","joybu5k","True","None","t3_14f1iqi","False","None","None","None","[]","t1_joybu5k","False","0","t1_joy271n","/r/AIDungeon/comments/14f1iqi/how_to_make_it_act_like_i_a_chatroom/joybu5k/","None","","[]","1687350556","False","2","False","True","False","AIDungeon","t5_29uaei","r/AIDungeon","public","None","0","[]","None","1693286101","2","[]",""
"[]","None","None","False","None","-zamtheman-","None","None","[]","None","None","None","text","t2_v60gqxmq","False","False","False","[]","None","None","I'm not sure about the specifics
But you could use authors notes and the prompt itself, and the ai would probably get a good jist of what you're trying to do.


Hope that helps!","True","False","False","None","None","None","None","0","1687352497.0","2023-06-21-150137","1687352497.0","None","0","False","0","joyfnhx","False","None","t3_14f1iqi","False","None","None","None","[]","t1_joyfnhx","True","0","t3_14f1iqi","/r/AIDungeon/comments/14f1iqi/how_to_make_it_act_like_i_a_chatroom/joyfnhx/","None","","[]","1687352527","False","2","False","True","False","AIDungeon","t5_29uaei","r/AIDungeon","public","None","0","[]","None","1693286779","2","[]",""
"[]","None","None","False","None","-zamtheman-","None","None","[]","None","None","None","text","t2_v60gqxmq","False","False","False","[]","None","None","From my experience you could try making the ai do that like in the prompt for the world and authors notes it might work.

Then there's the good ol' retry button and stuff, though I guess that's not the vibe you're going for.

There's also copying stories almost like living through different versions of the same world.

And lastly the only tried and true method, if you turn on improve ai, you occasionally get those multiple options to choose from.","True","False","False","None","None","None","None","0","1687352826.0","2023-06-21-150706","1687352826.0","None","0","False","0","joygarp","False","None","t3_14emo8f","False","None","None","None","[]","t1_joygarp","True","0","t3_14emo8f","/r/AIDungeon/comments/14emo8f/question/joygarp/","None","","[]","1687352857","False","2","False","True","False","AIDungeon","t5_29uaei","r/AIDungeon","public","None","0","[]","None","1693286890","2","[]",""
"[]","None","None","False","None","Top_Complaint5211","None","None","[]","None","None","None","text","t2_c47qctnj","False","False","False","[]","None","None","I tried passing the prompt in the memory and say write it like a text chat. And it didn't work","True","False","False","None","None","None","None","0","1687353181.0","2023-06-21-151301","1687353181.0","None","0","False","0","joyh0nl","True","None","t3_14f1iqi","False","None","None","None","[]","t1_joyh0nl","True","0","t1_joyfnhx","/r/AIDungeon/comments/14f1iqi/how_to_make_it_act_like_i_a_chatroom/joyh0nl/","None","","[]","1687353212","False","1","False","True","False","AIDungeon","t5_29uaei","r/AIDungeon","public","None","0","[]","None","1693287015","1","[]",""
"[]","None","None","False","None","Top_Complaint5211","None","None","[]","None","None","None","text","t2_c47qctnj","False","False","False","[]","None","None","I found a couple that has nsfw","True","False","False","None","None","None","None","0","1687353207.0","2023-06-21-151327","1687353207.0","None","0","False","0","joyh2lt","True","None","t3_14f1iqi","False","None","None","None","[]","t1_joyh2lt","False","0","t1_joy271n","/r/AIDungeon/comments/14f1iqi/how_to_make_it_act_like_i_a_chatroom/joyh2lt/","None","","[]","1687353237","False","1","False","True","False","AIDungeon","t5_29uaei","r/AIDungeon","public","None","0","[]","None","1693287024","1","[]",""
"[]","None","None","False","None","-zamtheman-","None","None","[]","None","None","None","text","t2_v60gqxmq","False","False","False","[]","None","None","Welp another idea is to overwhelm it, pass the prompt in the memory


Then play only on say, I think that'll bring out similar effects, cos the ai tries to match your writing style.
It's once happened to me while I was using ""say"" that the entire adventure was just so many people talking to each other.

Hope that helps.","True","False","False","None","None","None","None","0","1687353704.0","2023-06-21-152144","1687353704.0","None","0","False","0","joyi3dn","False","None","t3_14f1iqi","False","None","None","None","[]","t1_joyi3dn","True","0","t1_joyh0nl","/r/AIDungeon/comments/14f1iqi/how_to_make_it_act_like_i_a_chatroom/joyi3dn/","None","","[]","1687353735","False","2","False","True","False","AIDungeon","t5_29uaei","r/AIDungeon","public","None","0","[]","None","1693287217","2","[]",""
"[]","None","None","False","None","Beacda","None","None","[]","None","None","None","text","t2_v07d7pk7","False","False","False","[]","None","None","Damm","True","False","False","None","None","None","None","0","1687354716.0","2023-06-21-153836","1687354716.0","None","0","False","0","joyk8ae","False","None","t3_14ekav3","False","None","None","None","[]","t1_joyk8ae","True","0","t3_14ekav3","/r/AIDungeon/comments/14ekav3/this_is_the_best_thing_ive_read_all_day_for_some/joyk8ae/","None","","[]","1687354748","False","3","False","True","False","AIDungeon","t5_29uaei","r/AIDungeon","public","None","0","[]","None","1693287594","3","[]",""
"[]","None","None","False","None","Ok-Championship5029","None","None","[]","None","None","None","text","t2_jc32t6le","False","False","False","[]","None","None","Are you pressing the correct ""Are you 18"" button?","True","False","False","None","None","None","None","0","1687361401.0","2023-06-21-173001","1687361401.0","None","0","False","0","joyzvjk","False","None","t3_14f6db0","False","None","None","None","[]","t1_joyzvjk","False","0","t3_14f6db0","/r/AIDungeon/comments/14f6db0/filter_not_switching/joyzvjk/","None","","[]","1687361432","False","2","False","True","False","AIDungeon","t5_29uaei","r/AIDungeon","public","None","0","[]","None","1693290366","2","[]",""
"[]","None","None","False","None","SuperCoolGuy56","None","None","[]","None","None","None","text","t2_10vieb3h","False","False","False","[]","None","None","Draw a fursona of that, I dare you.","True","False","False","None","None","None","None","0","1687363852.0","2023-06-21-181052","1687363852.0","None","0","False","0","joz63j1","True","None","t3_14fbq9d","False","None","None","None","[]","t1_joz63j1","False","0","t3_14fbq9d","/r/AIDungeon/comments/14fbq9d/okidoki_time_to_wash_my_eyeballs_with_lots_of_soap/joz63j1/","None","","[]","1687363882","False","10","False","True","False","AIDungeon","t5_29uaei","r/AIDungeon","public","None","0","[]","None","1693291460","10","[]",""
"[]","None","None","False","None","Ok-Championship5029","None","None","[]","None","None","None","text","t2_jc32t6le","False","False","False","[]","None","None","Nuke the site from orbit, it's the only way to be sure.","True","False","False","None","None","None","None","0","1687364129.0","2023-06-21-181529","1687364129.0","None","0","False","0","joz6sr3","False","None","t3_14fbq9d","False","None","None","None","[]","t1_joz6sr3","False","0","t3_14fbq9d","/r/AIDungeon/comments/14fbq9d/okidoki_time_to_wash_my_eyeballs_with_lots_of_soap/joz6sr3/","None","","[]","1687364160","False","9","False","True","False","AIDungeon","t5_29uaei","r/AIDungeon","public","None","0","[]","None","1693291585","9","[]",""
"[]","None","None","False","None","SuperCoolGuy56","None","None","[]","None","None","None","text","t2_10vieb3h","False","False","False","[]","None","None","It would kill to many allayed people, his group is split into many groups. I made a story up of someone in the Anti-Vore organization which being a part of is mostly a death sentence anyways. He only has 6 people and is down to 5 as the anthro vagina killed someone with it's tentacles. Edit: 4 someone else was absorbed by it.","True","False","False","None","None","None","None","0","1687364503.0","2023-06-21-182143","1687364503.0","None","0","False","0","joz7qom","True","None","t3_14fbq9d","False","None","None","None","[]","t1_joz7qom","False","0","t1_joz6sr3","/r/AIDungeon/comments/14fbq9d/okidoki_time_to_wash_my_eyeballs_with_lots_of_soap/joz7qom/","None","","[]","1687364535","False","7","False","True","False","AIDungeon","t5_29uaei","r/AIDungeon","public","None","0","[]","None","1693291748","7","[]",""
"[]","None","None","False","None","Decay_0f_Ang3ls","None","None","[]","None","None","None","text","t2_b73rnfnw","False","False","False","[]","None","None","I do not give them any money.","True","False","False","None","None","None","None","0","1687366582.0","2023-06-21-185622","1687366582.0","None","0","False","0","jozd4il","True","None","t3_14edmu1","False","None","None","None","[]","t1_jozd4il","True","0","t1_jowe0yj","/r/AIDungeon/comments/14edmu1/ai_dungeon_error/jozd4il/","None","","[]","1687366613","False","3","False","True","False","AIDungeon","t5_29uaei","r/AIDungeon","public","None","0","[]","None","1693292698","3","[]",""
"[]","None","None","False","None","Robodingo","None","None","[]","None","None","None","text","t2_lb75t","False","False","False","[]","None","None","I'm 90% sure it's trained off AO3 stories.","True","False","False","None","None","None","None","0","1687366628.0","2023-06-21-185708","1687366628.0","None","0","False","0","jozd8t9","False","None","t3_14ekav3","False","None","None","None","[]","t1_jozd8t9","False","0","t1_joveg76","/r/AIDungeon/comments/14ekav3/this_is_the_best_thing_ive_read_all_day_for_some/jozd8t9/","None","","[]","1687366659","False","7","False","True","False","AIDungeon","t5_29uaei","r/AIDungeon","public","None","0","[]","None","1693292719","7","[]",""
"[]","None","None","False","None","ColdofWinter1","None","None","[]","None","None","None","text","t2_6q84dpnv","False","False","False","[]","None","None","Yes, I did","True","False","False","None","None","None","None","0","1687367501.0","2023-06-21-191141","1687367501.0","None","0","False","0","jozfhlz","True","None","t3_14f6db0","False","None","None","None","[]","t1_jozfhlz","True","0","t1_joyzvjk","/r/AIDungeon/comments/14f6db0/filter_not_switching/jozfhlz/","None","","[]","1687367532","False","1","False","True","False","AIDungeon","t5_29uaei","r/AIDungeon","public","None","0","[]","None","1693293113","1","[]",""
