"[]","None","None","False","None","Renegade888888","None","None","[]","None","None","None","text","t2_7wwi9qqm","False","False","False","[]","None","None","Lemme guess, you laid the dragon instead of slaying it.","True","False","False","None","None","None","None","0","1686074903.0","2023-06-06-200823","1686074903.0","None","0","False","0","jn5dxav","False","None","t3_142n39y","False","None","None","None","[]","t1_jn5dxav","False","0","t3_142n39y","/r/AIDungeon/comments/142n39y/me_5_minutes_into_literally_any_campaign/jn5dxav/","None","","[]","1686074936","False","19","False","True","False","AIDungeon","t5_29uaei","r/AIDungeon","public","None","0","[]","None","1692830632","19","[]"
"[]","None","None","False","None","Honestnt","None","None","[]","None","None","None","text","t2_bwfplo9pt","False","False","True","[]","None","None","I'll have you know I, um, plunged my weapon deep inside of it","True","False","False","None","None","None","None","0","1686075774.0","2023-06-06-202254","1686075774.0","None","0","False","0","jn5g71n","True","None","t3_142n39y","False","None","None","None","[]","t1_jn5g71n","False","0","t1_jn5dxav","/r/AIDungeon/comments/142n39y/me_5_minutes_into_literally_any_campaign/jn5g71n/","None","","[]","1686075810","False","18","False","True","False","AIDungeon","t5_29uaei","r/AIDungeon","public","None","0","[]","None","1692831107","18","[]"
"[]","None","None","False","None","TheWorldWeWillDieIn","None","None","[]","None","None","None","text","t2_40tnxwm9","False","False","False","[]","None","None","Check if your memory length is 2048 instead of 1024 that Dragon J2 is supposed to have. Putting it back down fixed it for me.","True","False","False","None","None","None","None","0","1686075782.0","2023-06-06-202302","1686075782.0","None","0","False","0","jn5g7qa","False","None","t3_1428i0m","False","None","None","None","[]","t1_jn5g7qa","True","0","t3_1428i0m","/r/AIDungeon/comments/1428i0m/cant_form_a_cohesive_sentence/jn5g7qa/","None","","[]","1686075819","False","2","False","True","False","AIDungeon","t5_29uaei","r/AIDungeon","public","None","0","[]","None","1692831105","2","[]"
"[]","None","None","False","None","CerealCrab","None","None","[]","None","None","None","text","t2_31h20k","False","False","False","[]","None","None","I found that the Griffin 2.0 they were beta testing was actually even more repetitive and got stuck in loops more often than regular Griffin, if that was even possible","True","False","False","None","None","None","None","0","1686086003.0","2023-06-06-231323","1686086003.0","None","0","False","0","jn6751g","False","None","t3_1427mjh","False","None","None","None","[]","t1_jn6751g","False","0","t1_jn4ise6","/r/AIDungeon/comments/1427mjh/griffin_our_free_model_interesting_and_unexpected/jn6751g/","None","","[]","1686086036","False","4","False","True","False","AIDungeon","t5_29uaei","r/AIDungeon","public","None","0","[]","None","1692836627","4","[]"
"[]","None","None","False","None","-Recursive","None","None","[]","None","None","None","text","t2_vzsf4e77","False","False","False","[]","None","None","Hey me too! It tried to kill my characters way more often as well...","True","False","False","None","None","None","None","0","1686086225.0","2023-06-06-231705","1686086225.0","None","0","False","0","jn67p8u","False","None","t3_1427mjh","False","None","None","None","[]","t1_jn67p8u","False","0","t1_jn6751g","/r/AIDungeon/comments/1427mjh/griffin_our_free_model_interesting_and_unexpected/jn67p8u/","None","","[]","1686086261","False","4","False","True","False","AIDungeon","t5_29uaei","r/AIDungeon","public","None","0","[]","None","1692836743","4","[]"
"[]","None","None","False","None","Aromatic_Club_4919","None","None","[]","None","None","None","text","t2_cgsn9y0j0","False","False","False","[]","None","None","…accurate? ♾️%.","True","False","False","None","None","None","None","0","1686086948.0","2023-06-06-232908","1686086948.0","None","0","False","0","jn69j89","False","None","t3_142n39y","False","None","None","None","[]","t1_jn69j89","False","0","t3_142n39y","/r/AIDungeon/comments/142n39y/me_5_minutes_into_literally_any_campaign/jn69j89/","None","","[]","1686086987","False","4","False","True","False","AIDungeon","t5_29uaei","r/AIDungeon","public","None","0","[]","None","1692837106","4","[]"
"[]","None","None","False","None","JAMES_Gaming_LV2","None","None","[]","None","None","None","text","t2_3n0zerz8","False","False","False","[]","None","None","Didn't Latitude technically kill Count Grey (and all the other ""external characters"") when they updated the AI model (or whatever they did) a long time back","True","False","False","None","None","None","None","0","1686088774.0","2023-06-06-235934","1686088774.0","None","0","False","0","jn6e4qe","False","None","t3_1427mjh","False","None","None","None","[]","t1_jn6e4qe","False","0","t1_jn4ise6","/r/AIDungeon/comments/1427mjh/griffin_our_free_model_interesting_and_unexpected/jn6e4qe/","None","","[]","1686088809","False","6","False","True","False","AIDungeon","t5_29uaei","r/AIDungeon","public","None","0","[]","None","1692838037","6","[]"
"[]","None","None","False","None","-Recursive","None","None","[]","None","None","None","text","t2_vzsf4e77","False","False","False","[]","None","None","Yeppers, good times though.","True","False","False","None","None","None","None","0","1686088890.0","2023-06-07-000130","1686088890.0","None","0","False","0","jn6eev1","False","None","t3_1427mjh","False","None","None","None","[]","t1_jn6eev1","True","0","t1_jn6e4qe","/r/AIDungeon/comments/1427mjh/griffin_our_free_model_interesting_and_unexpected/jn6eev1/","None","","[]","1686088923","False","1","False","True","False","AIDungeon","t5_29uaei","r/AIDungeon","public","None","0","[]","None","1692838086","1","[]"
"[]","None","None","False","None","izarra_gosea","None","None","[]","None","None","None","text","t2_gwm7ni03","False","False","False","[]","None","None","I had this issue a few days ago.

I reduced the temperature and it hasn't happened since. The temperature was higher than default to counteract the repetitiveness.","True","False","False","None","None","None","None","0","1686089112.0","2023-06-07-000512","1686089112.0","None","0","False","0","jn6ey8f","False","None","t3_1428i0m","False","None","None","None","[]","t1_jn6ey8f","True","0","t3_1428i0m","/r/AIDungeon/comments/1428i0m/cant_form_a_cohesive_sentence/jn6ey8f/","None","","[]","1686089148","False","2","False","True","False","AIDungeon","t5_29uaei","r/AIDungeon","public","None","0","[]","None","1692838188","2","[]"
"[]","None","None","False","None","Solidclaw","None","None","[]","None","None","None","text","t2_4gi8bc3j","False","False","False","[]","None","None","Me realizing it’s much easier to bang the minotaur then fight it","True","False","False","None","None","None","None","0","1686089182.0","2023-06-07-000622","1686089182.0","None","0","False","0","jn6f4a9","False","None","t3_142n39y","False","None","None","None","[]","t1_jn6f4a9","False","0","t3_142n39y","/r/AIDungeon/comments/142n39y/me_5_minutes_into_literally_any_campaign/jn6f4a9/","None","","[]","1686089220","False","11","False","True","False","AIDungeon","t5_29uaei","r/AIDungeon","public","None","0","[]","None","1692838222","11","[]"
"[]","None","None","False","None","Kyxibat","None","None","[]","None","None","None","text","t2_48puh6ng","False","False","False","[]","None","None","Perhaps thats why they removed it?","True","False","False","None","None","None","None","0","1686089292.0","2023-06-07-000812","1686089292.0","None","0","False","0","jn6fdt0","False","None","t3_1427mjh","False","None","None","None","[]","t1_jn6fdt0","False","0","t1_jn6751g","/r/AIDungeon/comments/1427mjh/griffin_our_free_model_interesting_and_unexpected/jn6fdt0/","None","","[]","1686089329","False","4","False","True","False","AIDungeon","t5_29uaei","r/AIDungeon","public","None","0","[]","None","1692838277","4","[]"
"[]","None","None","False","None","CALlCO","None","None","[]","None","None","None","text","t2_7ypbsn9r","False","False","False","[]","None","None","I tried this a while ago but making my character and the world was annoying. You know any like, pre loaded stuff for this?","True","False","False","None","None","None","None","0","1686094568.0","2023-06-07-013608","1686094568.0","None","0","False","0","jn6rool","False","None","t3_142n39y","False","None","None","None","[]","t1_jn6rool","False","0","t3_142n39y","/r/AIDungeon/comments/142n39y/me_5_minutes_into_literally_any_campaign/jn6rool/","None","","[]","1686094603","False","5","False","True","False","AIDungeon","t5_29uaei","r/AIDungeon","public","None","0","[]","None","1692840744","5","[]"
"[]","None","None","False","None","Sophytes","None","None","[]","None","None","None","text","t2_513ot0ou","False","False","False","[]","None","None","Hey, could you put a link to the other parts mentioned in this document?, it is very informative :)","True","False","False","None","None","None","None","0","1686095115.0","2023-06-07-014515","1686095115.0","None","0","False","0","jn6swzu","False","None","t3_141tyla","False","None","None","None","[]","t1_jn6swzu","True","0","t1_jn1pelg","/r/AIDungeon/comments/141tyla/need_tip_for_descriptions/jn6swzu/","None","","[]","1686095155","False","2","False","True","False","AIDungeon","t5_29uaei","r/AIDungeon","public","None","0","[]","None","1692840987","2","[]"
"[]","None","None","False","None","CerealCrab","None","None","[]","None","None","None","text","t2_31h20k","False","False","False","[]","None","None","I haven't seen Count Grey yet but I saw Lord Rostov in an adventure a few months ago, and there are other recurring names that still show up such as Velzix, the Nightmare Tyrant, the Zalan Empire, and the Vampire Clans","True","False","False","None","None","None","None","0","1686096194.0","2023-06-07-020314","1686096194.0","None","0","False","0","jn6vakg","False","None","t3_1427mjh","False","None","None","None","[]","t1_jn6vakg","False","0","t1_jn6e4qe","/r/AIDungeon/comments/1427mjh/griffin_our_free_model_interesting_and_unexpected/jn6vakg/","None","","[]","1686096230","False","4","False","True","False","AIDungeon","t5_29uaei","r/AIDungeon","public","None","0","[]","None","1692841457","4","[]"
"[]","None","None","False","None","JAMES_Gaming_LV2","None","None","[]","None","None","None","text","t2_3n0zerz8","False","False","False","[]","None","None","Count Grey used to appear all the time since he was a major character in the AI's old training data, then he was eventually removed, along with a few other characters who also appeared in the training data, you can't exactly find him anymore unless you manually add him to a game","True","False","False","None","None","None","None","0","1686096350.0","2023-06-07-020550","1686096350.0","None","0","False","0","jn6vmkz","False","None","t3_1427mjh","False","None","None","None","[]","t1_jn6vmkz","True","0","t1_jn6vakg","/r/AIDungeon/comments/1427mjh/griffin_our_free_model_interesting_and_unexpected/jn6vmkz/","None","","[]","1686096388","False","3","False","True","False","AIDungeon","t5_29uaei","r/AIDungeon","public","None","0","[]","None","1692841522","3","[]"
"[]","None","None","False","None","Kyxibat","None","None","[]","None","None","None","text","t2_48puh6ng","False","False","False","[]","None","None","https://old.reddit.com/r/AIDungeon/comments/q6ef4z/guide_to_ai_dungeon_styles_part_2/

I was only able to find Part 2, sorry! It doesn't seem part 3 exists, but here ya go.","True","False","False","None","None","None","None","0","1686096641.0","2023-06-07-021041","1686096641.0","None","0","False","0","jn6w9qj","False","None","t3_141tyla","False","None","None","None","[]","t1_jn6w9qj","True","0","t1_jn6swzu","/r/AIDungeon/comments/141tyla/need_tip_for_descriptions/jn6w9qj/","None","","[]","1686096675","False","1","False","True","False","AIDungeon","t5_29uaei","r/AIDungeon","public","None","0","[]","None","1692841649","1","[]"
"[]","None","None","False","None","KwaXDkp","None","None","[]","None","None","None","text","t2_cpty3bsj","False","False","False","[]","None","None","I want to know what I'm doing wrong and why. I'm trying several things and nothing changes, a perfectly explained solution would help me a lot. I'll keep updating to show you how the AI ​​is going and see if I'm making any more mistakes.","True","False","False","None","None","None","None","0","1686100423.0","2023-06-07-031343","1686100423.0","None","0","False","0","jn74e43","True","None","t3_142z2hd","False","None","None","None","[]","t1_jn74e43","True","0","t3_142z2hd","/r/AIDungeon/comments/142z2hd/i_see_no_change_in_authors_notes/jn74e43/","None","","[]","1686100457","False","3","False","True","False","AIDungeon","t5_29uaei","r/AIDungeon","public","None","0","[]","None","1692843262","3","[]"
"[]","None","None","False","None","Ryan5011","None","None","[]","None","None","None","text","t2_jat1x","False","False","False","[]","None","None","I find putting a ""---"" on its own line between scenes helps avoid this to some degree","True","False","False","None","None","None","None","0","1686102950.0","2023-06-07-035550","1686102950.0","None","0","False","0","jn79v56","False","None","t3_1427mjh","False","None","None","None","[]","t1_jn79v56","True","0","t1_jn4ld8x","/r/AIDungeon/comments/1427mjh/griffin_our_free_model_interesting_and_unexpected/jn79v56/","None","","[]","1686102985","False","1","False","True","False","AIDungeon","t5_29uaei","r/AIDungeon","public","None","0","[]","None","1692844333","1","[]"
"[]","None","None","False","None","chrismcelroyseo","None","None","[]","None","None","None","text","t2_hta1m","False","False","False","[]","None","None","It's been my experience that combining too many writing styles at once can confuse the AI. Have you tried simplifying it to just two writing styles like ""use a verbose suspenseful writing style""?

And maybe not trying to give it two different sections like you did in your example. No difference between action scenes and other scenes. In each scene, go into author notes and change it to what you want it to be rather than giving it 2 sections at once.

Here's an example of how you can get some extra things in there without confusing it I believe.

Use a suspenseful, dark fantasy writing style in present tense and limited third person perspective. Add detailed auditory and vivid descriptions. This scene has a scary tone. Avoid abrupt transitions.

That last part about avoiding abrupt transitions keeps it from jumping from the middle of one of your scenes to things like ""and then they get some sleep and the next morning...""","True","False","False","None","None","None","None","0","1686103420.0","2023-06-07-040340","1686103420.0","None","0","False","0","jn7av08","False","None","t3_142z2hd","False","None","None","None","[]","t1_jn7av08","False","0","t1_jn74e43","/r/AIDungeon/comments/142z2hd/i_see_no_change_in_authors_notes/jn7av08/","None","","[]","1686103458","False","7","False","True","False","AIDungeon","t5_29uaei","r/AIDungeon","public","None","0","[]","None","1692844525","7","[]"
"[]","None","None","False","None","EmbarrassedSquare823","None","None","[]","None","None","None","text","t2_butiimwe","False","False","False","[]","None","None","After using AID for years or something, idk time is weird XD
 I have a quick phone note of stuff I copy and paste for specific styles I like. So you can at least make following play throughs easier to set up. To be fair, it helps I only ever use literally one character regardless of universe 😅

I do want to check, are the pre-made quick Start options not what you are talking about? Those are right there from the start. Maybe they weren't a thing when you tried it (I definitely haven't been here forever, may have missed that time), or I'm misunderstanding what you are looking for.

(Edited this original paragraph here out- I'm tired af and forgot to keep the answer actually related to the question)","True","False","False","None","None","None","None","0","1686103731.0","2023-06-07-040851","1686103731.0","None","0","False","0","jn7bikz","False","None","t3_142n39y","False","None","None","None","[]","t1_jn7bikz","True","0","t1_jn6rool","/r/AIDungeon/comments/142n39y/me_5_minutes_into_literally_any_campaign/jn7bikz/","None","","[]","1686103769","False","3","False","True","False","AIDungeon","t5_29uaei","r/AIDungeon","public","None","0","[]","None","1692844656","3","[]"
"[]","None","None","False","None","CALlCO","None","None","[]","None","None","None","text","t2_7ypbsn9r","False","False","False","[]","None","None","I was wondering actually if the pre made ones could end up as spicy really, they weren't a thing when I tried it out","True","False","False","None","None","None","None","0","1686103834.0","2023-06-07-041034","1686103834.0","None","0","False","0","jn7bqds","False","None","t3_142n39y","False","None","None","None","[]","t1_jn7bqds","True","0","t1_jn7bikz","/r/AIDungeon/comments/142n39y/me_5_minutes_into_literally_any_campaign/jn7bqds/","None","","[]","1686103866","False","3","False","True","False","AIDungeon","t5_29uaei","r/AIDungeon","public","None","0","[]","None","1692844698","3","[]"
"[]","None","None","False","None","EmbarrassedSquare823","None","None","[]","None","None","None","text","t2_butiimwe","False","False","False","[]","None","None","Spicy in what way? Like, sexual? My friend you can make literally anything spicy in this AI even without trying. It's scarily easy.","True","False","False","None","None","None","None","0","1686103932.0","2023-06-07-041212","1686103932.0","None","0","False","0","jn7bxqs","False","None","t3_142n39y","False","None","None","None","[]","t1_jn7bxqs","False","0","t1_jn7bqds","/r/AIDungeon/comments/142n39y/me_5_minutes_into_literally_any_campaign/jn7bxqs/","None","","[]","1686103967","False","7","False","True","False","AIDungeon","t5_29uaei","r/AIDungeon","public","None","0","[]","None","1692844735","7","[]"
"[]","None","None","False","None","CALlCO","None","None","[]","None","None","None","text","t2_7ypbsn9r","False","False","False","[]","None","None","I shall return when I have determined if my endeavors have been successful","True","False","False","None","None","None","None","0","1686104062.0","2023-06-07-041422","1686104062.0","None","0","False","0","jn7c7dk","False","None","t3_142n39y","False","None","None","None","[]","t1_jn7c7dk","False","0","t1_jn7bxqs","/r/AIDungeon/comments/142n39y/me_5_minutes_into_literally_any_campaign/jn7c7dk/","None","","[]","1686104095","False","4","False","True","False","AIDungeon","t5_29uaei","r/AIDungeon","public","None","0","[]","None","1692844782","4","[]"
"[]","None","None","False","None","KwaXDkp","None","None","[]","None","None","None","text","t2_cpty3bsj","False","False","False","[]","None","None","Man you helped me a lot, I didn't realize that way, I wish the writing style was more descriptive, and I specifically wanted that every time a character says something, the AI ​​describes how the character feels and what he does about it as he talks. About this second part I wanted to know what style of writing would fit for this. You already gave me a big north","True","False","False","None","None","None","None","0","1686104303.0","2023-06-07-041823","1686104303.0","None","0","False","0","jn7cpkz","True","None","t3_142z2hd","False","None","None","None","[]","t1_jn7cpkz","True","0","t1_jn7av08","/r/AIDungeon/comments/142z2hd/i_see_no_change_in_authors_notes/jn7cpkz/","None","","[]","1686104334","False","3","False","True","False","AIDungeon","t5_29uaei","r/AIDungeon","public","None","0","[]","None","1692844882","3","[]"
"[]","None","None","False","None","EmbarrassedSquare823","None","None","[]","None","None","None","text","t2_butiimwe","False","False","False","[]","None","None","You shall soon be baptized in the pure essence of:

""But God, why can't I go to heaven?""

""Because child...I saw what you did in AI Dungeon.""

""Oh, f***.""","True","False","False","None","None","None","None","0","1686104363.0","2023-06-07-041923","1686104363.0","None","0","False","0","jn7cu4t","False","None","t3_142n39y","False","None","None","None","[]","t1_jn7cu4t","False","0","t1_jn7c7dk","/r/AIDungeon/comments/142n39y/me_5_minutes_into_literally_any_campaign/jn7cu4t/","None","","[]","1686104401","False","4","False","True","False","AIDungeon","t5_29uaei","r/AIDungeon","public","None","0","[]","None","1692844905","4","[]"
"[]","None","None","False","None","Ok-Championship5029","None","None","[]","None","None","None","text","t2_jc32t6le","False","False","False","[]","None","None","Monkey sees action...","True","False","False","None","None","None","None","0","1686104679.0","2023-06-07-042439","1686104679.0","None","0","False","0","jn7di73","False","None","t3_142n39y","False","None","None","None","[]","t1_jn7di73","True","0","t3_142n39y","/r/AIDungeon/comments/142n39y/me_5_minutes_into_literally_any_campaign/jn7di73/","None","","[]","1686104709","False","3","False","True","False","AIDungeon","t5_29uaei","r/AIDungeon","public","None","0","[]","None","1692845036","3","[]"
"[]","None","None","False","None","chrismcelroyseo","None","None","[]","None","None","None","text","t2_hta1m","False","False","False","[]","None","None","I like the thoughts and feelings thing too and I'm still experimenting with that but here's an example of what I have found works at least some of the time.

Explore ""insert character's"" introspective thoughts during scenes.

The ""character named Bob"" thinks to himself often. Using introspective writing style to describe Bob's thoughts.

These are two Google docs I made to help cut down some of the confusion about writing styles, author's note, tone and everything that you can put into Styles in AI dungeon.

Part one covers writing styles

https://www.reddit.com/r/AIDungeon/comments/q6e30c/guide_to_ai_dungeon_styles/?utm_medium=android_app&utm_source=share

Part two covers mood and tone and all of that.

https://www.reddit.com/r/AIDungeon/comments/q6ef4z/guide_to_ai_dungeon_styles_part_2/?utm_medium=android_app&utm_source=share

Almost all of this came from other people. All I did was do my best to trim it down and simplify it.","True","False","False","None","None","None","None","0","1686104885.0","2023-06-07-042805","1686104885.0","None","0","False","0","jn7dxzz","False","None","t3_142z2hd","False","None","None","None","[]","t1_jn7dxzz","False","0","t1_jn7cpkz","/r/AIDungeon/comments/142z2hd/i_see_no_change_in_authors_notes/jn7dxzz/","None","","[]","1686104919","False","5","False","True","False","AIDungeon","t5_29uaei","r/AIDungeon","public","None","0","[]","None","1692845120","5","[]"
"[]","None","None","False","None","KwaXDkp","None","None","[]","None","None","None","text","t2_cpty3bsj","False","False","False","[]","None","None","I would like the feeling to be demonstrated visually and not what the other character is really thinking. What do you think I can do? For example ""Argo looks surprised...""","True","False","False","None","None","None","None","0","1686105419","2023-06-07-043659","1686105419","None","0","1686106147","0","jn7f1yf","True","None","t3_142z2hd","False","None","None","None","[]","t1_jn7f1yf","True","0","t1_jn7dxzz","/r/AIDungeon/comments/142z2hd/i_see_no_change_in_authors_notes/jn7f1yf/","None","","[]","1686105458","False","3","False","True","False","AIDungeon","t5_29uaei","r/AIDungeon","public","None","0","[]","None","1687937569","3","[]"
"[]","None","None","False","None","CALlCO","None","None","[]","None","None","None","text","t2_7ypbsn9r","False","False","False","[]","None","None","For me it's being very difficult. Like the AI isn't continuing with any action I can respond to even when I straight up initiate :c. I changed it to make the monster horny and it didn't do anything

*In Kedar if that helps?*","True","False","False","None","None","None","None","0","1686106478.0","2023-06-07-045438","1686106478.0","None","0","False","0","jn7h7t0","False","None","t3_142n39y","False","None","None","None","[]","t1_jn7h7t0","True","0","t1_jn7cu4t","/r/AIDungeon/comments/142n39y/me_5_minutes_into_literally_any_campaign/jn7h7t0/","None","","[]","1686106515","False","2","False","True","False","AIDungeon","t5_29uaei","r/AIDungeon","public","None","0","[]","None","1692845750","2","[]"
"[]","None","None","False","None","CALlCO","None","None","[]","None","None","None","text","t2_7ypbsn9r","False","False","False","[]","None","None","Like straight up edited it to say the beast is horny and it did jack all","True","False","False","None","None","None","None","0","1686107216.0","2023-06-07-050656","1686107216.0","None","0","False","0","jn7iojx","False","None","t3_142n39y","False","None","None","None","[]","t1_jn7iojx","True","0","t1_jn7cu4t","/r/AIDungeon/comments/142n39y/me_5_minutes_into_literally_any_campaign/jn7iojx/","None","","[]","1686107253","False","2","False","True","False","AIDungeon","t5_29uaei","r/AIDungeon","public","None","0","[]","None","1692846024","2","[]"
