"all_awardings","allow_live_comments","archived","author","author_created_utc","author_flair_background_color","author_flair_css_class","author_flair_richtext","author_flair_template_id","author_flair_text","author_flair_text_color","author_flair_type","author_fullname","author_patreon_flair","author_premium","awarders","banned_by","can_gild","can_mod_post","category","content_categories","contest_mode","created_date","created_utc","discussion_type","distinguished","domain","edited","gilded","hidden","hide_score","id","is_created_from_ads_ui","is_crosspostable","is_meta","is_original_content","is_reddit_media_domain","is_robot_indexable","is_self","is_video","link_flair_background_color","link_flair_css_class","link_flair_richtext","link_flair_template_id","link_flair_text","link_flair_text_color","link_flair_type","locked","media","media_metadata","media_only","name","no_follow","num_comments","num_crossposts","over_18","parent_whitelist_status","permalink","pinned","pwls","quarantine","removed_by","removed_by_category","retrieved_on","score","secure_media","selftext","send_replies","spoiler","stickied","subreddit","subreddit_id","subreddit_name_prefixed","subreddit_subscribers","subreddit_type","suggested_sort","thumbnail","thumbnail_height","thumbnail_width","title","top_awarded_type","total_awards_received","treatment_tags","upvote_ratio","url","view_count","whitelist_status","wls"
"[]","False","False","Parr_Daniel-2483","1616158426","None","None","[]","None","None","None","text","t2_b0bs3xdn","False","False","[]","None","True","False","None","None","False","2023-03-01-074446","1677653086","None","None","self.AIDungeon","False","0","False","False","11ewqxs","False","False","False","False","False","False","True","False","","feedback","[]","ab2df5da-1ac8-11ea-9c1c-0e4df316c103","Feedback","dark","text","False","None","None","False","t3_11ewqxs","True","1","0","False","None","/r/AIDungeon/comments/11ewqxs/ai_news_anchor_reports_disturbing_news/","False","None","False","None","automod_filtered","1681024825","1","None","[removed]","True","False","False","AIDungeon","t5_29uaei","r/AIDungeon","43278","public","None","default","None","None","AI News Anchor Reports Disturbing News: Schoolgirls Poisoned in Iran to Halt Education for Girls","None","0","[]","0.66","https://www.reddit.com/r/AIDungeon/comments/11ewqxs/ai_news_anchor_reports_disturbing_news/","None","None","None"
"[]","False","False","Alans_Sound","1622359033","None","None","[]","None","None","None","text","t2_cejuqi8s","False","False","[]","None","True","False","None","None","False","2023-03-01-193116","1677695476","None","None","i.redd.it","False","0","False","False","11fbcfi","False","True","False","False","True","True","False","False","","adventure","[]","a23d301c-1ac8-11ea-8ec5-0e528b1d55b5","Adventure","dark","text","False","None","","False","t3_11fbcfi","False","64","0","False","None","/r/AIDungeon/comments/11fbcfi/attempted_to_jokingly_scare_my_girl_from_behind/","False","None","False","None","None","1681024300","128","None","","True","False","False","AIDungeon","t5_29uaei","r/AIDungeon","43278","public","None","https://b.thumbs.redditmedia.com/fPl4_UDejSPCFdQhDIkeacmfhFMdbiy212_Vn9bxDuA.jpg","140","140","Attempted to jokingly scare my girl from behind... didn't quite go as planned","None","0","[]","0.98","https://i.redd.it/iqt4us90q7la1.png","None","None","None","image","True","[{""id"": ""rFQjGYl8ZmtfbkzhYc22RcVwfkYvbJFeC5tyYWZN4ag"", ""resolutions"": [{""height"": 156, ""url"": ""https://preview.redd.it/iqt4us90q7la1.png?width=108&amp;crop=smart&amp;auto=webp&amp;v=enabled&amp;s=d42d36eb2fbcf5af3ef09c77bbd60ba979dba7c8"", ""width"": 108}, {""height"": 312, ""url"": ""https://preview.redd.it/iqt4us90q7la1.png?width=216&amp;crop=smart&amp;auto=webp&amp;v=enabled&amp;s=782c050f6a8e627be2858d235ee19a144636dd64"", ""width"": 216}, {""height"": 463, ""url"": ""https://preview.redd.it/iqt4us90q7la1.png?width=320&amp;crop=smart&amp;auto=webp&amp;v=enabled&amp;s=2235649df4b7524dbc62968945c42766c016013a"", ""width"": 320}, {""height"": 926, ""url"": ""https://preview.redd.it/iqt4us90q7la1.png?width=640&amp;crop=smart&amp;auto=webp&amp;v=enabled&amp;s=740b1b3621be0f6533b46718945d2a23b2d516ca"", ""width"": 640}, {""height"": 1389, ""url"": ""https://preview.redd.it/iqt4us90q7la1.png?width=960&amp;crop=smart&amp;auto=webp&amp;v=enabled&amp;s=5ecf0410a74ad5121e34f42f0f4ed62ebbccf588"", ""width"": 960}, {""height"": 1563, ""url"": ""https://preview.redd.it/iqt4us90q7la1.png?width=1080&amp;crop=smart&amp;auto=webp&amp;v=enabled&amp;s=341371d11ab58673e600e6c15a624551b8fc8de8"", ""width"": 1080}], ""source"": {""height"": 1563, ""url"": ""https://preview.redd.it/iqt4us90q7la1.png?auto=webp&amp;v=enabled&amp;s=403556e0640d2ee43e3147bf655ad642b092c710"", ""width"": 1080}, ""variants"": {}}]","https://i.redd.it/iqt4us90q7la1.png"
"[]","False","False","chipy4848","1480281366","None","None","[]","None","None","None","text","t2_134ry2","False","False","[]","None","True","False","None","None","False","2023-03-01-225050","1677707450","None","None","self.AIDungeon","False","0","False","False","11fj9ca","False","True","False","False","False","True","True","False","","feedback","[]","ab2df5da-1ac8-11ea-9c1c-0e4df316c103","Feedback","dark","text","False","None","","False","t3_11fj9ca","False","7","0","False","None","/r/AIDungeon/comments/11fj9ca/annual_check_in_to_see_if_the_game_is_what_it/","False","None","False","None","None","1681024081","8","None","Spent hours on this before the ai went downhill but I still have hope it’ll be good again. How is it now? Any better?","True","False","False","AIDungeon","t5_29uaei","r/AIDungeon","43277","public","None","self","None","None","Annual check in to see if the game is what it used to be?","None","0","[]","0.84","https://www.reddit.com/r/AIDungeon/comments/11fj9ca/annual_check_in_to_see_if_the_game_is_what_it/","None","None","None","","","",""
"[]","False","False","Parr_Daniel-2483","1616158426","None","None","[]","None","None","None","text","t2_b0bs3xdn","False","False","[]","None","True","False","None","None","False","2023-03-02-093200","1677745920","None","None","reddit.com","False","0","False","False","11fxj4s","False","False","False","False","False","False","False","False","","advice","[]","c49db2f4-1acc-11ea-ae68-0e3b75a4386f","news","dark","text","False","None","","False","t3_11fxj4s","True","0","0","False","None","/r/AIDungeon/comments/11fxj4s/ai_news_anchor_reports_brnews_schoolgirls/","False","None","False","None","reddit","1681023579","0","None","","True","False","False","AIDungeon","t5_29uaei","r/AIDungeon","43276","public","None","default","None","None","AI News Anchor Reports BrNews: Schoolgirls Poisoned in Iran to Halt Education for Girls","None","0","[]","0.5","https://www.reddit.com/r/AIGeneratedArt/comments/11ez3kv/ai_news_anchor_reports_disturbing_news/?utm_source=share&amp;utm_medium=web2x&amp;context=3","None","None","None","","","","https://www.reddit.com/r/AIGeneratedArt/comments/11ez3kv/ai_news_anchor_reports_disturbing_news/?utm_source=share&amp;utm_medium=web2x&amp;context=3"
"[]","False","False","RooFucker2001","1617205456","None","None","[]","None","None","None","text","t2_b942o13h","False","False","[]","None","True","False","None","None","False","2023-03-02-114449","1677753889","None","None","self.AIDungeon","False","0","False","False","11fzqey","False","True","False","False","False","True","True","False","","None","[]","","None","dark","text","False","None","","False","t3_11fzqey","False","3","0","False","None","/r/AIDungeon/comments/11fzqey/do_i_have_to_publish_scenarios_in_scenarios_to/","False","None","False","None","None","1681023507","1","None","uh oh..","True","False","False","AIDungeon","t5_29uaei","r/AIDungeon","43276","public","None","self","None","None","Do I have to publish scenario's in scenario's to make them playable.","None","0","[]","1.0","https://www.reddit.com/r/AIDungeon/comments/11fzqey/do_i_have_to_publish_scenarios_in_scenarios_to/","None","None","None","","","",""
"[]","False","False","GigaxGames","None","None","None","[]","None","None","None","text","t2_v4aigjmo","False","False","[]","None","True","False","None","None","False","2023-03-02-145318","1677765198","None","None","v.redd.it","False","0","False","False","11g3bqh","False","False","False","False","True","False","False","True","","None","[]","","None","dark","text","False","","","False","t3_11g3bqh","True","0","0","False","None","/r/AIDungeon/comments/11g3bqh/trying_to_make_a_3d_version_of_ai_dungeon/","False","None","False","None","moderator","1681023379","1","","","True","False","False","AIDungeon","t5_29uaei","r/AIDungeon","43276","public","None","default","93","140","Trying to make a 3d version of AI Dungeon - feedback very welcome!","None","0","[]","1.0","https://v.redd.it/bn5ufv4qzbla1","None","None","None","","","","https://v.redd.it/bn5ufv4qzbla1","4800","https://v.redd.it/bn5ufv4qzbla1/DASHPlaylist.mpd?a=1683615378%2CODZlZTgzNDM1Y2IwMDJiMWI1NzVjZGIzNmY4MTljNDUxYTBhZDEzNDhlMjk5YjczMDAxODM2NjNhNGUwMmJjNw%3D%3D&amp;v=1&amp;f=sd","10","https://v.redd.it/bn5ufv4qzbla1/DASH_1080.mp4?source=fallback","1080","https://v.redd.it/bn5ufv4qzbla1/HLSPlaylist.m3u8?a=1683615378%2CNzM0MjE2ZDg4MjY3ODljMzNmMzFjNWJlOWQwMTE5YzFiOWZhMDUzZWVhOTU5NmM1OTRmODdlN2JiN2U1ZjU2Zg%3D%3D&amp;v=1&amp;f=sd","False","https://v.redd.it/bn5ufv4qzbla1/DASH_96.mp4","completed","1616","4800","https://v.redd.it/bn5ufv4qzbla1/DASHPlaylist.mpd?a=1683615378%2CODZlZTgzNDM1Y2IwMDJiMWI1NzVjZGIzNmY4MTljNDUxYTBhZDEzNDhlMjk5YjczMDAxODM2NjNhNGUwMmJjNw%3D%3D&amp;v=1&amp;f=sd","10","https://v.redd.it/bn5ufv4qzbla1/DASH_1080.mp4?source=fallback","1080","https://v.redd.it/bn5ufv4qzbla1/HLSPlaylist.m3u8?a=1683615378%2CNzM0MjE2ZDg4MjY3ODljMzNmMzFjNWJlOWQwMTE5YzFiOWZhMDUzZWVhOTU5NmM1OTRmODdlN2JiN2U1ZjU2Zg%3D%3D&amp;v=1&amp;f=sd","False","https://v.redd.it/bn5ufv4qzbla1/DASH_96.mp4","completed","1616"
"[]","False","False","hypatieproject","1603730315","None","None","[]","None","None","None","text","t2_8h8xyso6","False","False","[]","None","True","False","None","None","False","2023-03-02-151028","1677766228","None","None","v.redd.it","False","0","False","False","11g3pu3","False","True","False","False","True","True","False","True","","None","[]","","None","dark","text","False","","","False","t3_11g3pu3","False","51","0","False","None","/r/AIDungeon/comments/11g3pu3/trying_to_make_a_3d_version_of_ai_dungeon/","False","None","False","None","None","1681023364","244","","","True","False","False","AIDungeon","t5_29uaei","r/AIDungeon","43276","public","None","https://b.thumbs.redditmedia.com/cLH4bWA7nDDugmEQgCdzZxf5l4kNshIeS51an_QPt3o.jpg","93","140","Trying to make a 3d version of AI Dungeon - Feedback very welcome !","None","0","[]","0.96","https://v.redd.it/gggg3het2cla1","None","None","None","hosted:video","False","[{""id"": ""THBUD5eUZg0aL3BKLnFp599egQ7eMVjKyM45Lc9LtoU"", ""resolutions"": [{""height"": 72, ""url"": ""https://external-preview.redd.it/1ozmlOt_4EDY9RfXyd7vBZU6evhPVTnNZKh2FTbTmsw.png?width=108&amp;crop=smart&amp;format=pjpg&amp;auto=webp&amp;v=enabled&amp;s=932e193d0026a602cfb244dc895c557b0e30dbe5"", ""width"": 108}, {""height"": 144, ""url"": ""https://external-preview.redd.it/1ozmlOt_4EDY9RfXyd7vBZU6evhPVTnNZKh2FTbTmsw.png?width=216&amp;crop=smart&amp;format=pjpg&amp;auto=webp&amp;v=enabled&amp;s=0fb7a4079bacfe40e0d3ae2c76d0c61bf596f4ce"", ""width"": 216}, {""height"": 213, ""url"": ""https://external-preview.redd.it/1ozmlOt_4EDY9RfXyd7vBZU6evhPVTnNZKh2FTbTmsw.png?width=320&amp;crop=smart&amp;format=pjpg&amp;auto=webp&amp;v=enabled&amp;s=ec3d091a1335e92d9844d790a714cf7d79d3c4e9"", ""width"": 320}, {""height"": 427, ""url"": ""https://external-preview.redd.it/1ozmlOt_4EDY9RfXyd7vBZU6evhPVTnNZKh2FTbTmsw.png?width=640&amp;crop=smart&amp;format=pjpg&amp;auto=webp&amp;v=enabled&amp;s=1de67b57c2c5209c9d3b2fbbf104c387e69ff4d5"", ""width"": 640}, {""height"": 641, ""url"": ""https://external-preview.redd.it/1ozmlOt_4EDY9RfXyd7vBZU6evhPVTnNZKh2FTbTmsw.png?width=960&amp;crop=smart&amp;format=pjpg&amp;auto=webp&amp;v=enabled&amp;s=f8b48d353698f6ea151ca4dd2cf39bdbe3e7899f"", ""width"": 960}, {""height"": 722, ""url"": ""https://external-preview.redd.it/1ozmlOt_4EDY9RfXyd7vBZU6evhPVTnNZKh2FTbTmsw.png?width=1080&amp;crop=smart&amp;format=pjpg&amp;auto=webp&amp;v=enabled&amp;s=54b64d7d330da5659029c51e142bdbf6327b654b"", ""width"": 1080}], ""source"": {""height"": 1130, ""url"": ""https://external-preview.redd.it/1ozmlOt_4EDY9RfXyd7vBZU6evhPVTnNZKh2FTbTmsw.png?format=pjpg&amp;auto=webp&amp;v=enabled&amp;s=743c5ebe74a74cc7316703d23cf737a4382f7f5f"", ""width"": 1690}, ""variants"": {}}]","https://v.redd.it/gggg3het2cla1","4800","https://v.redd.it/gggg3het2cla1/DASHPlaylist.mpd?a=1683615364%2COTZjMmRkZDhkMTQzM2E2YWQ0YzlmMWQyM2I5YzRhODg0YTY0N2UwNjA3M2RhYWI0ZTllODMwNThlYzVjMTE3ZQ%3D%3D&amp;v=1&amp;f=sd","7","https://v.redd.it/gggg3het2cla1/DASH_1080.mp4?source=fallback","1080","https://v.redd.it/gggg3het2cla1/HLSPlaylist.m3u8?a=1683615364%2CMDAyMzE5ODJhNTRiZDVkNWFjYmJlMGMzYmIyZjYwNGFkNDc3NGY5YzAzOGZiNjY5YjcwMmE2OWI1OGU0YmY4Nw%3D%3D&amp;v=1&amp;f=sd","False","https://v.redd.it/gggg3het2cla1/DASH_96.mp4","completed","1616","4800","https://v.redd.it/gggg3het2cla1/DASHPlaylist.mpd?a=1683615364%2COTZjMmRkZDhkMTQzM2E2YWQ0YzlmMWQyM2I5YzRhODg0YTY0N2UwNjA3M2RhYWI0ZTllODMwNThlYzVjMTE3ZQ%3D%3D&amp;v=1&amp;f=sd","7","https://v.redd.it/gggg3het2cla1/DASH_1080.mp4?source=fallback","1080","https://v.redd.it/gggg3het2cla1/HLSPlaylist.m3u8?a=1683615364%2CMDAyMzE5ODJhNTRiZDVkNWFjYmJlMGMzYmIyZjYwNGFkNDc3NGY5YzAzOGZiNjY5YjcwMmE2OWI1OGU0YmY4Nw%3D%3D&amp;v=1&amp;f=sd","False","https://v.redd.it/gggg3het2cla1/DASH_96.mp4","completed","1616"
"[]","False","False","myfaceisfreddy","1594272730","None","None","[]","None","None","None","text","t2_6cq3m5vu","False","False","[]","None","True","False","None","None","False","2023-03-02-210454","1677787494","None","None","self.AIDungeon","False","0","False","False","11gcfme","False","True","False","False","False","True","True","False","","feedback","[]","ab2df5da-1ac8-11ea-9c1c-0e4df316c103","Feedback","dark","text","False","None","","False","t3_11gcfme","False","1","0","False","None","/r/AIDungeon/comments/11gcfme/how_do_i_do_that_my_scenario_dosent_have_any/","False","None","False","None","None","1681023042","1","None","Please, i have been struggling for some time now. Any help will be needed","True","False","False","AIDungeon","t5_29uaei","r/AIDungeon","43276","public","None","self","None","None","How do i do that my scenario dosen't have any script like ""you are now the king"" has i want it bland.","None","0","[]","1.0","https://www.reddit.com/r/AIDungeon/comments/11gcfme/how_do_i_do_that_my_scenario_dosent_have_any/","None","None","None","","","","","","","","","","","","","","","","","","","","","","","",""
"[]","False","False","TheNoSpaceScrub","1465522707","None","None","[]","None","None","None","text","t2_yljvl","False","False","[]","None","True","False","None","None","False","2023-03-02-235231","1677797551","None","None","self.AIDungeon","False","0","False","False","11gihnf","False","True","False","False","False","True","True","False","","advice","[]","c49db2f4-1acc-11ea-ae68-0e3b75a4386f","Advice","dark","text","False","None","","False","t3_11gihnf","False","1","0","False","None","/r/AIDungeon/comments/11gihnf/ai_dungeon_scenario_formatting_guide_thing/","False","None","False","None","None","1681022862","8","None","I don't know if this will help anyone, since I don't go on here very much anymore. But since there are very few posts on this subreddit these days, maybe whoever needs this will find it. I'm also an AI Dungeon veteran, having played on-and-off since the day the explore page was added, so I should know what I am talking about hopefully.
#Prompt
For the prompt, the best thing you can do is be good at conventional writing. At the very least, don't leave typos and grammar mistakes in, since it'll throw off the AI. A bit of a pro tip for writing a good prompt (and keeping the AI more consistent) is to occasionally throw in a semicolon, colon, or em dash—it makes the AI think of text which has those punctuation marks in them, which is often better than text completely bereft of them. The prompt is also probably the best place to introduce placeholders.

Placeholders are what I call ${these things}, and what I will call them henceforth. Placeholders are really quite simple: with the exception of ${character.name} which prompts you with ""Enter your character's name…"" instead of ""character.name"" they prompt you with the string of text inside the curly brackets. Then, every single instance of that placeholder, including instances in memory and author's note, but not the adventure's description, title, or world info, is changed to the string of text entered by the player. For whatever reason, while placeholders in the author's note are replaced as normal, the placeholder has to also occur in the prompt for the player to be prompted for it. That's probably a bug, but it's very minor. If something is important enough to be in the author's note, then it should probably be mentioned in the prompt.
#Memory
The Memory is where you put general information that you want the AI to actually remember. The AI only remembers so much of the story up to the point you are at, so you need to put things here you want it to remember. For best results, everything should be in simple sentences. Also try to avoid saying that something is NOT the case because the AI may act as if it is the case because it is stupid. Instead, say that something else is the case (“you are not red” vs “you are blue”).

Some people swear by brackets to help keep the AI on track. Related sentences are grouped in brackets like so, demonstrated with a hypothetical character: [Billy Bob is tall. Billy Bob is scrawny.] [Billy Bob speaks with a southern accent.] And so on. From my personal experience, brackets do actually slightly help and they are not much of a time waste if they actually have no actual benefit.
#World Info
Use World Info to hold memory similarly to the Memory section. All the tips for Memory apply here, except for the fact that placeholders do not work in any capacity within World Info. Keys (that is, the text that triggers the entry to be added to memory temporarily) are not case sensitive. Also, especially if the key is short, it can be embedded in unrelated output. For example, if “Nate” is a key, the entry would be triggered by the word “alternate.” This rarely matters, but it is the case. Adding alternate keys makes the World Info entry get triggered more frequently, which is good for making sure that the AI has a better understanding of it.
#Author's Note
Once again, placeholders are sort of weird here. If they exist in the prompt, they are properly replaced, but being in only Author’s Note or Author’s Note and Memory makes the game never prompt the player to fill them in, so the story begins with the placeholder still in Author’s Note. Regardless, treat this section like Memory, but for the absolute most important details of the adventure. Also the seemingly intended purpose of Author’s Note—to get the AI to write a certain way—actually does work a whole lot better than my jaded preconceptions borne of being very experienced with this AI’s stupidity led me to believe. Tell it to focus on certain details or write in a certain way and you might be surprised by how much it actually has a notable impact.
#Scripting
The only experience I have ever had with scripting is trying to access Author’s Note when it was still a premium feature. I never actually figured out how to do that, by the way. Sometimes, at night, I see the beast in my room, and in my nightmares it rears its ugly incomprehensible head. Wayward strings of text surround me as I hear the blood-curdling screams of my brain cells, slaughtered by the cold brutality of this uncompromisingly complex world.

So that’s a tutorial for someone more qualified.","True","False","False","AIDungeon","t5_29uaei","r/AIDungeon","43276","public","None","self","None","None","AI Dungeon Scenario Formatting Guide Thing","None","0","[]","0.99","https://www.reddit.com/r/AIDungeon/comments/11gihnf/ai_dungeon_scenario_formatting_guide_thing/","None","None","None","","","","","","","","","","","","","","","","","","","","","","","",""
"[]","False","False","Jescka66","None","None","None","[]","None","None","None","text","t2_txpd83sy","False","False","[]","None","True","False","None","None","False","2023-03-03-053258","1677817978","None","None","self.AIDungeon","False","0","False","False","11gras1","False","False","False","False","False","False","True","False","","None","[]","","None","dark","text","False","None","","False","t3_11gras1","True","0","0","False","None","/r/AIDungeon/comments/11gras1/are_you_tired_of_generic_lifeless_avatars_that/","False","None","False","None","reddit","1681022566","1","None","[removed]","True","False","False","AIDungeon","t5_29uaei","r/AIDungeon","43276","public","None","default","None","None","Are you tired of generic, lifeless avatars that don't reflect your personality or mood?","None","0","[]","1.0","https://www.reddit.com/r/AIDungeon/comments/11gras1/are_you_tired_of_generic_lifeless_avatars_that/","None","None","None","","","","","","","","","","","","","","","","","","","","","","","",""
"[]","False","False","[deleted]","None","","None","","None","None","dark","","","","","[]","None","False","False","None","None","False","2023-03-03-063228","1677821548","None","None","","False","0","False","False","11gsh0l","False","False","False","False","False","False","True","False","","adventure","[]","a23d301c-1ac8-11ea-8ec5-0e528b1d55b5","Adventure","dark","text","False","None","","False","t3_11gsh0l","False","0","0","False","None","/r/AIDungeon/comments/11gsh0l/ai_powered_twitch_text_adventure_tests/","False","None","False","None","deleted","1681022523","1","None","[deleted]","True","False","False","AIDungeon","t5_29uaei","r/AIDungeon","43276","public","None","default","None","None","AI Powered Twitch Text Adventure Tests!","None","0","[]","0.67","","None","None","None","","","","","","","","","","","","","","","","","","","","","","","",""
"[]","False","False","pipedreamer007","1597167246","None","None","[]","None","None","None","text","t2_6e8686t1","False","False","[]","None","True","False","None","None","False","2023-03-03-074002","1677825602","None","None","self.AIDungeon","False","0","False","False","11gtpy1","False","True","False","False","False","True","True","False","","None","[]","","None","dark","text","False","None","","False","t3_11gtpy1","False","11","0","False","None","/r/AIDungeon/comments/11gtpy1/chatgpt_question_on_march_player_survey/","False","None","False","None","None","1681022477","2","None","If you take AIDungeon's survey on AI models, one of the questions is whether we'd like an option to use OpenAI's ChatGPT.  I \\*KNOW\\* the issue is very divisive among this community especially but here's my thoughts/opinion.  


1. **OpenAI's GPT-3 model was and STILL is vastly superior than anything else**  
I've subscribed to NovelAI multiple times hoping their model (Euterpe) would come close but (in my opinion) it never came close to the creativity/understanding that GPT-3 had.  AI21's Jumbo model is a complete joke.  I've tried it multiple times and always got tired of it after a couple days.  

2. **A ChatGPT model option would be a game-changer**  
If ChatGPT can come close to old Dragon I'd re-subscribe in a heartbeat.   Heck, I'd be willing to pay slightly more to access an unlimited version of the model.   For all Latitude's efforts so far, the unfortunate truth (for me and this is my opinion) is that none of the current models hold a candle to GPT-3.  If ChatGPT is slightly worst/the same/better, then I would happily continue writing the stories I wrote/generated with GPT-3.  

3. **Censorship is a hard pill to swallow**  
Hopefully, Latitude will include the ChatGPT model option.  Although it would ***greatly detract*** from my enjoyment of the service, I think even the current (censored) model of ChatGPT would be better than nothing.  Of course, I'm hoping &amp; prefer an uncensored model. 🤞  

4.  **I'd accept higher price for unlimited access**  
Latitude offered unlimited access BEFORE OpenAI lowered their prices on GPT-3.  I heard they supposedly lost money on the deal (?).  But I would be willing to pay extra for the option to use ChatGPT (or GPT-3) model.

Those are my two cents...I've been waiting for over a year to continue my adventures.  I'm really hoping Latitude offers an OpenAI AI model again.","True","False","False","AIDungeon","t5_29uaei","r/AIDungeon","43276","public","None","self","None","None","ChatGPT question on March Player Survey","None","0","[]","0.59","https://www.reddit.com/r/AIDungeon/comments/11gtpy1/chatgpt_question_on_march_player_survey/","None","None","None","","","","","","","","","","","","","","","","","","","","","","","",""
