"all_awardings","approved_at_utc","approved_by","archived","associated_award","author","author_flair_background_color","author_flair_css_class","author_flair_richtext","author_flair_template_id","author_flair_text","author_flair_text_color","author_flair_type","author_fullname","author_is_blocked","author_patreon_flair","author_premium","awarders","banned_at_utc","banned_by","body","can_gild","can_mod_post","collapsed","collapsed_because_crowd_control","collapsed_reason","collapsed_reason_code","comment_type","controversiality","created","created_date","created_utc","distinguished","downs","edited","gilded","id","is_submitter","likes","link_id","locked","mod_note","mod_reason_by","mod_reason_title","mod_reports","name","no_follow","num_reports","parent_id","permalink","removal_reason","replies","report_reasons","retrieved_on","saved","score","score_hidden","send_replies","stickied","subreddit","subreddit_id","subreddit_name_prefixed","subreddit_type","top_awarded_type","total_awards_received","treatment_tags","unrepliable_reason","updated_on","ups","user_reports"
"[]","None","None","False","None","MothMan3759","None","None","[]","None","None","None","text","t2_cplvznx8","False","False","False","[]","None","None","Assuming you can't use it, it's just showing people what they are missing out on.","True","False","False","None","None","None","None","0","1685583087.0","2023-06-01-033127","1685583087.0","None","0","False","0","jmf5and","False","None","t3_13x4j1a","False","None","None","None","[]","t1_jmf5and","False","0","t3_13x4j1a","/r/AIDungeon/comments/13x4j1a/is_is_this_a_bug_why_does_it_show_the_dragon/jmf5and/","None","","[]","1687905379","False","14","False","True","False","AIDungeon","t5_29uaei","r/AIDungeon","public","None","0","[]","None","1692640624","14","[]"
"[]","None","None","False","None","poobradoor22","None","None","[]","None","None","None","text","t2_2p0fcu25","False","False","False","[]","None","None","It seems like i can use it? It loaded itself up on it's own, same happened for wyvern when it was being retired a few days ago, i don't think griffin is loaded since griffin makes responses longer than 3 sentences","True","False","False","None","None","None","None","0","1685583270.0","2023-06-01-033430","1685583270.0","None","0","1685583575.0","0","jmf5pc6","True","None","t3_13x4j1a","False","None","None","None","[]","t1_jmf5pc6","False","0","t1_jmf5and","/r/AIDungeon/comments/13x4j1a/is_is_this_a_bug_why_does_it_show_the_dragon/jmf5pc6/","None","","[]","1687905393","False","8","False","True","False","AIDungeon","t5_29uaei","r/AIDungeon","public","None","0","[]","None","1692640709","8","[]"
"[]","None","None","False","None","Ok-Championship5029","None","None","[]","None","None","None","text","t2_jc32t6le","False","False","False","[]","None","None","Enter in a prompt, after it generates, go to the left hand corner, press the gear, press the three dots, and it should be in the options.
If you have issues still, just explore around the menu for a second and you'll probably find it.","True","False","False","None","None","None","None","0","1685595134.0","2023-06-01-065214","1685595134.0","None","0","False","0","jmfswtm","False","None","t3_13w5ow1","False","None","None","None","[]","t1_jmfswtm","True","0","t1_jmcamn9","/r/AIDungeon/comments/13w5ow1/got_back_into_it/jmfswtm/","None","","[]","1687906139","False","1","False","True","False","AIDungeon","t5_29uaei","r/AIDungeon","public","None","0","[]","None","1692646048","1","[]"
"[]","None","None","False","None","Njuregen","None","None","[]","None","None","None","text","t2_ce1378bu","False","False","False","[]","None","None","old but.

I understand issues with paypal they removed it last year, so mid June?

I also cannot register cause CC here are not that useful cause we have an excellent bank billing online system that is accepted nearly worldwide and for many online games, steam, amazon, etc. I'll never get a CC just for 1 site imv.","True","False","False","None","None","None","None","0","1685623542.0","2023-06-01-144542","1685623542.0","None","0","False","0","jmgwvno","False","None","t3_zvsmf7","False","None","None","None","[]","t1_jmgwvno","True","0","t3_zvsmf7","/r/AIDungeon/comments/zvsmf7/how_do_i_buy_premium/jmgwvno/","None","","[]","1687907425","False","1","False","True","False","AIDungeon","t5_29uaei","r/AIDungeon","public","None","0","[]","None","1692654941","1","[]"
"[]","None","None","False","None","sapphirestar22","None","None","[]","None","None","None","text","t2_7ys0rbj1","False","False","False","[]","None","None","understandable.","True","False","False","None","None","None","None","0","1685625945.0","2023-06-01-152545","1685625945.0","None","0","False","0","jmh2123","False","None","t3_13t6etg","False","None","None","None","[]","t1_jmh2123","True","0","t1_jm9urmw","/r/AIDungeon/comments/13t6etg/any_good_nsfw_scenarios/jmh2123/","None","","[]","1687907591","False","1","False","True","False","AIDungeon","t5_29uaei","r/AIDungeon","public","None","0","[]","None","1692656033","1","[]"
"[]","None","None","False","None","torntight","None","None","[]","None","None","None","text","t2_51m1vk9v","False","False","False","[]","None","None","As a British person who has been to a pub, can confirm, this is accurate.","True","False","False","None","None","None","None","0","1685629911.0","2023-06-01-163151","1685629911.0","None","0","False","0","jmhberc","False","None","t3_13t4sq5","False","None","None","None","[]","t1_jmhberc","True","0","t3_13t4sq5","/r/AIDungeon/comments/13t4sq5/average_brexit_supporter_at_the_pub/jmhberc/","None","","[]","1687907892","False","3","False","True","False","AIDungeon","t5_29uaei","r/AIDungeon","public","None","0","[]","None","1692657977","3","[]"
"[]","None","None","False","None","izarra_gosea","None","None","[]","None","None","None","text","t2_gwm7ni03","False","False","False","[]","None","None","I did. Setting the temp to 1.2 helped.
But it still really likes certain phrases.","True","False","False","None","None","None","None","0","1685633723.0","2023-06-01-173523","1685633723.0","None","0","False","0","jmhl61i","True","None","t3_13w7r1z","False","None","None","None","[]","t1_jmhl61i","False","0","t1_jmerjdm","/r/AIDungeon/comments/13w7r1z/no_more_wyvern/jmhl61i/","None","","[]","1687908207","False","3","False","True","False","AIDungeon","t5_29uaei","r/AIDungeon","public","None","0","[]","None","1692659984","3","[]"
"[]","None","None","False","None","Legendarystuff16","None","None","[]","None","None","None","text","t2_emttnbjw","False","False","False","[]","None","None","Is it live yet?","True","False","False","None","None","None","None","0","1685638603.0","2023-06-01-185643","1685638603.0","None","0","False","0","jmhy9wv","False","None","t3_wi4d5q","False","None","None","None","[]","t1_jmhy9wv","True","0","t1_ijas2vy","/r/AIDungeon/comments/wi4d5q/the_app_icon_disappeared_and_i_cant_choose_play/jmhy9wv/","None","","[]","1687908627","False","1","False","True","False","AIDungeon","t5_29uaei","r/AIDungeon","public","None","0","[]","None","1692662667","1","[]"
"[]","None","None","False","None","MagyTheMage","None","None","[]","None","None","None","text","t2_3mnwfjdi","False","False","False","[]","None","None","same thing here, i was confused on why it allowed me to use it lol

&#x200B;

maybe thats the old dragon model thats getting retired and they are leaving it for comparision?","True","False","False","None","None","None","None","0","1685640404.0","2023-06-01-192644","1685640404.0","None","0","False","0","jmi314d","False","None","t3_13x4j1a","False","None","None","None","[]","t1_jmi314d","True","0","t3_13x4j1a","/r/AIDungeon/comments/13x4j1a/is_is_this_a_bug_why_does_it_show_the_dragon/jmi314d/","None","","[]","1687908779","False","3","False","True","False","AIDungeon","t5_29uaei","r/AIDungeon","public","None","0","[]","None","1692663629","3","[]"
"[]","None","None","False","None","Ryan_Latitude","None","None","[]","None","None","None","text","t2_e0x8bldn","False","False","False","[]","None","None","This was fixed a very long time ago. Play store issue that was resolved. You should be able to find the app with no issue.","True","False","False","None","None","None","None","0","1685646055.0","2023-06-01-210055","1685646055.0","None","0","False","0","jmii66o","False","None","t3_wi4d5q","False","None","None","None","[]","t1_jmii66o","True","0","t1_jmhy9wv","/r/AIDungeon/comments/wi4d5q/the_app_icon_disappeared_and_i_cant_choose_play/jmii66o/","None","","[]","1687909267","False","1","False","True","False","AIDungeon","t5_29uaei","r/AIDungeon","public","None","0","[]","None","1692666679","1","[]"
"[]","None","None","False","None","Lord_Passion","None","None","[]","None","None","None","text","t2_527zhnjx","False","False","False","[]","None","None","Is Gryphon AI ever going to get upgraded, or is that going to be behind a paywall too? I'm tired of this broken ai model,  I don't have the money to spend on apps.","True","False","False","None","None","None","None","0","1685646135.0","2023-06-01-210215","1685646135.0","None","0","False","0","jmiidmq","False","None","t3_13w7r1z","False","None","None","None","[]","t1_jmiidmq","True","0","t1_jmamq1b","/r/AIDungeon/comments/13w7r1z/no_more_wyvern/jmiidmq/","None","","[]","1687909274","False","1","False","True","False","AIDungeon","t5_29uaei","r/AIDungeon","public","None","0","[]","None","1692666720","1","[]"
"[]","None","None","False","None","onew_iasag","None","None","[]","None","None","None","text","t2_6wjmfqdzi","False","False","False","[]","None","None","What about the griffin 2.0? I just had lost myself for a couple of weeks","True","False","False","None","None","None","None","0","1685648072.0","2023-06-01-213432","1685648072.0","None","0","False","0","jminhkr","False","None","t3_13w7r1z","False","None","None","None","[]","t1_jminhkr","False","0","t1_jmc00zf","/r/AIDungeon/comments/13w7r1z/no_more_wyvern/jminhkr/","None","","[]","1687909436","False","1","False","True","False","AIDungeon","t5_29uaei","r/AIDungeon","public","None","0","[]","None","1692667736","1","[]"
"[]","None","None","False","None","latitude_official","None","None","[]","None","None","None","text","t2_ugspbkxi","False","False","False","[]","None","None","Yep! We’re working on an update for Griffin.","True","False","False","None","None","None","None","0","1685648738.0","2023-06-01-214538","1685648738.0","None","0","False","0","jmipacr","False","None","t3_13w7r1z","False","None","None","None","[]","t1_jmipacr","True","0","t1_jmiidmq","/r/AIDungeon/comments/13w7r1z/no_more_wyvern/jmipacr/","None","","[]","1687909494","False","1","False","True","False","AIDungeon","t5_29uaei","r/AIDungeon","public","None","0","[]","None","1692668092","1","[]"
"[]","None","None","False","None","latitude_official","None","None","[]","None","None","None","text","t2_ugspbkxi","False","False","False","[]","None","None","We’re currently working on a new version of Griffin","True","False","False","None","None","None","None","0","1685648781.0","2023-06-01-214621","1685648781.0","None","0","False","0","jmipekz","False","None","t3_13w7r1z","False","None","None","None","[]","t1_jmipekz","False","0","t1_jminhkr","/r/AIDungeon/comments/13w7r1z/no_more_wyvern/jmipekz/","None","","[]","1687909498","False","1","False","True","False","AIDungeon","t5_29uaei","r/AIDungeon","public","None","0","[]","None","1692668115","1","[]"
"[]","None","None","False","None","poobradoor22","None","None","[]","None","None","None","text","t2_2p0fcu25","False","False","False","[]","None","None","Happened with wyvern for me too before it was removed, wonder why it's happening. If they wanted you to be able to do that, wouldn't they let you select it? The only way to know for sure is if the devs comment here, but i doubt that would happen.","True","False","False","None","None","None","None","0","1685649466.0","2023-06-01-215746","1685649466.0","None","0","False","0","jmir8eq","True","None","t3_13x4j1a","False","None","None","None","[]","t1_jmir8eq","True","0","t1_jmi314d","/r/AIDungeon/comments/13x4j1a/is_is_this_a_bug_why_does_it_show_the_dragon/jmir8eq/","None","","[]","1687909556","False","1","False","True","False","AIDungeon","t5_29uaei","r/AIDungeon","public","None","0","[]","None","1692668468","1","[]"
"[]","None","None","False","None","Bulbasaurbo1","None","None","[]","None","None","None","text","t2_6a9zm23d","False","False","False","[]","None","None","Yooo what da fuck","True","False","False","None","None","None","None","0","1685650889.0","2023-06-01-222129","1685650889.0","None","0","False","0","jmiv0r2","False","None","t3_13jpllh","False","None","None","None","[]","t1_jmiv0r2","True","0","t3_13jpllh","/r/AIDungeon/comments/13jpllh/the_ai_broke_character_to_comment_on_a_characters/jmiv0r2/","None","","[]","1687909678","False","2","False","True","False","AIDungeon","t5_29uaei","r/AIDungeon","public","None","0","[]","None","1692669222","2","[]"
"[]","None","None","False","None","[deleted]","","None","","None","None","dark","","","False","","","[]","None","None","Disagree. New dragon is extremely good. After being subbed to novelai for a year, I can confirm new dragon blows their models out of the water.","False","False","False","None","None","None","None","0","1685651146.0","2023-06-01-222546","1685651146.0","None","0","False","0","jmivp49","False","None","t3_13w5ow1","False","None","None","None","[]","t1_jmivp49","True","0","t1_jmceggb","/r/AIDungeon/comments/13w5ow1/got_back_into_it/jmivp49/","None","","[]","1687909699","False","1","False","True","False","AIDungeon","t5_29uaei","r/AIDungeon","public","None","0","[]","None","1692669357","1","[]"
"[]","None","None","False","None","Mr_Morrison13981","None","None","[]","None","None","None","text","t2_6zfm24yr","False","False","False","[]","None","None","I have no clue. It happens to me too.","True","False","False","None","None","None","None","0","1685659979.0","2023-06-02-005259","1685659979.0","None","0","False","0","jmjhndu","False","None","t3_13xuple","False","None","None","None","[]","t1_jmjhndu","True","0","t3_13xuple","/r/AIDungeon/comments/13xuple/why_does_the_ai_keep_generating_in_this_weird/jmjhndu/","None","","[]","1687910403","False","1","False","True","False","AIDungeon","t5_29uaei","r/AIDungeon","public","None","0","[]","None","1692673663","1","[]"
"[]","None","None","False","None","SPerk_2023","None","None","[]","None","None","None","text","t2_tv3r21qn","False","False","False","[]","None","None","Report the issue to support@aidungeon.io. Same thing happens to me, but it's probably a bug.","False","False","False","None","None","None","None","0","1685668079.0","2023-06-02-030759","1685668079.0","None","0","False","0","jmjzx4c","False","None","t3_13xuple","False","None","None","None","[]","t1_jmjzx4c","True","0","t3_13xuple","/r/AIDungeon/comments/13xuple/why_does_the_ai_keep_generating_in_this_weird/jmjzx4c/","None","","[]","1687910988","False","2","False","False","False","AIDungeon","t5_29uaei","r/AIDungeon","public","None","0","[]","None","1692677111","2","[]"
"[]","None","None","False","None","TheSigmaOne","None","None","[]","None","None","None","text","t2_s0no62mr","False","False","False","[]","None","None","It's pretty good","True","False","False","None","None","None","None","0","1685672774.0","2023-06-02-042614","1685672774.0","None","0","False","0","jmka6tf","False","None","t3_13xxc2a","False","None","None","None","[]","t1_jmka6tf","False","0","t3_13xxc2a","/r/AIDungeon/comments/13xxc2a/ever_wish_ai_dungeon_was_more_like_dd/jmka6tf/","None","","[]","1685672807","False","7","False","True","False","AIDungeon","t5_29uaei","r/AIDungeon","public","None","0","[]","None","1692679015","7","[]"
"[]","None","None","False","None","Queasy-Pollution6420","None","None","[]","None","None","None","text","t2_888el0h8r","False","False","False","[]","None","None","Omg I'm 73 yrs old!","True","False","False","None","None","None","None","0","1685677175.0","2023-06-02-053935","1685677175.0","None","0","False","0","jmkixiq","False","None","t3_i25q1q","False","None","None","None","[]","t1_jmkixiq","True","0","t3_i25q1q","/r/AIDungeon/comments/i25q1q/this_is_why_i_love_ai_dungeon/jmkixiq/","None","","[]","1685677207","False","1","False","True","False","AIDungeon","t5_29uaei","r/AIDungeon","public","None","0","[]","None","1692680606","1","[]"
"[]","None","None","False","None","[deleted]","","None","","None","None","dark","","","False","","","[]","None","None","[deleted]","True","False","False","None","None","None","None","0","1685677825.0","2023-06-02-055025","1685677825.0","None","0","False","0","jmkk3f1","False","None","t3_13xuple","False","None","None","None","[]","t1_jmkk3f1","True","0","t1_jmjhndu","/r/AIDungeon/comments/13xuple/why_does_the_ai_keep_generating_in_this_weird/jmkk3f1/","None","","[]","1685677863","False","1","False","True","False","AIDungeon","t5_29uaei","r/AIDungeon","public","None","0","[]","None","1692680820","1","[]"
"[]","None","None","False","None","Shadow122791","None","None","[]","None","None","None","text","t2_pv3vc5bf","False","False","False","[]","None","None","You know that's like the best I've seen it do with a description. Is it auto generated or is it your input?","True","False","False","None","None","None","None","0","1685677856.0","2023-06-02-055056","1685677856.0","None","0","False","0","jmkk5f8","False","None","t3_13xuple","False","None","None","None","[]","t1_jmkk5f8","False","0","t3_13xuple","/r/AIDungeon/comments/13xuple/why_does_the_ai_keep_generating_in_this_weird/jmkk5f8/","None","","[]","1685677894","False","2","False","True","False","AIDungeon","t5_29uaei","r/AIDungeon","public","None","0","[]","None","1692680831","2","[]"
"[]","None","None","False","None","Shadow122791","None","None","[]","None","None","None","text","t2_pv3vc5bf","False","False","False","[]","None","None","In the middle of the night a being calling himself Velzix flashes into Blaze's mind. ""I know you're here somewhere. Join me in ruling this planet. It's your place to lead u...."" Velzix say getting cut off by Blaze. ""Screw that. I'm not siding with you ya Cooler wannabe."" 


Velzix clinches his fist. "" That's unfortunate. Guess I just have to kill you again. I hope that wretched demoness is with you...""


Blaze comes out of his trance and looks around. Suddenly he feels an odd malicious and vile yet subtle shift as strange cool waves wash over him like the stuffy humid air on a windy but unbearablly hot 103 degree day. The magnetic feeling comimg from towards the center the nearby city.


Blaze doesn't know why but as it grows stronger he finds himself waking Larissa and the kids. Within a minute the bare essentials are packed and they are on the road.


Blaze carries Lilith as Larrisa carries her brother.


""Just trust me!"""" He says and sprints away from the city. 


As he runs it takes him a moment to notice he is covering a football field every second. 


Suddenly the energy in the air makes Blaze frantic as if death is a frieght train and he is chained to the tracks. 


Pressing harder there's a sonic boom as they break the sound barrier....


A Second later the field of energy fades away. Blaze stops after moving a few more miles, he turns around as an intense burst of the vile energy passes by. Directly after.... A purple twinkle falls into the city. Suddenly a 30 mile wide burst of energy.


Blaze raises an eyebrow setting down Lilith as he dashes forward crumbling a boulder and deflecting several cars and trucks in a split second. The energy shunting the pieces and objected of the city in all directions at supersonic speed.


Blaze let's out a steaming breath as his body protests but holds up.


He Looks over at Larrisa somewhat confused.


She grins. ""You sensed it to then. Glad you're getting more power and abilities back... Tho you should try and calm your energy and hide it.... Velzix can sense it but not locate us... I can't keep masking it for you as you grow stronger."" She says as they move quickly...


....


...


Hours later they stop at a little cabin in the woods after finding it abandon.


Sitting on the couch Blaze thinks back to the start of the zombie plague...

...","True","False","False","None","None","None","None","0","1685678821.0","2023-06-02-060701","1685678821.0","None","0","False","0","jmklvyv","True","None","t3_13v0m3c","False","None","None","None","[]","t1_jmklvyv","True","0","t3_13v0m3c","/r/AIDungeon/comments/13v0m3c/shadowverse_zombie_apocalypse_2037_great_palmer/jmklvyv/","None","","[]","1685678860","False","1","False","True","False","AIDungeon","t5_29uaei","r/AIDungeon","public","None","0","[]","None","1692681142","1","[]"
