t3_198oo05,Bug with MythoMax,"I keep getting this error whenever I try to use MythoMax at all. Also, whenever I try to do any normal prompt (can't remember the name), it just shows the text from ""custom.""",17,0.91,t2_l1fom5d8r,/r/AIDungeon/comments/198oo05/bug_with_mythomax/,,,,1705597875,,[],False,,,False,Agreeable_You1756,,,[],,,,text,False,False,False,[],,,False,False,,False,,False,1705468263.0,20240117-051103,1705468263.0,,,i.redd.it,0,False,0,False,False,198oo05,False,True,False,False,True,True,False,False,,#5a74cc,,[],fb19276e-9381-11ee-9eaa-2ab21dc32b0a,Bug Report,light,text,False,,,,,,,,,,,,,,,,,,,,,,,,,,,,,,,,,,,,,,,,,,,,,,,,,,,,,,,,,,,False,,,,,,,,,,,,,,,,[],False,3,0,0,False,,False,image,True,"[{""id"": ""tHsIa15PCI0Q8yTetLCHWUIQ4AvonjQil-IiYnViQrs"", ""resolutions"": [{""height"": 23, ""url"": ""https://preview.redd.it/r6czffiroxcc1.png?width=108&crop=smart&auto=webp&s=d9127c137f9cbd6f68a0c248138b9c08962cb405"", ""width"": 108}, {""height"": 46, ""url"": ""https://preview.redd.it/r6czffiroxcc1.png?width=216&crop=smart&auto=webp&s=06a3ed2923753a6dad85195763ca139ec05e206a"", ""width"": 216}, {""height"": 69, ""url"": ""https://preview.redd.it/r6czffiroxcc1.png?width=320&crop=smart&auto=webp&s=06c1962fbeb0b506c0364565c7268969b4a2eb9b"", ""width"": 320}, {""height"": 138, ""url"": ""https://preview.redd.it/r6czffiroxcc1.png?width=640&crop=smart&auto=webp&s=ec7c4d25d1caeef0c32ffb710cee263a1fbac903"", ""width"": 640}, {""height"": 208, ""url"": ""https://preview.redd.it/r6czffiroxcc1.png?width=960&crop=smart&auto=webp&s=673af0581f2372ca8b44edce967dd0a67e5cb780"", ""width"": 960}, {""height"": 234, ""url"": ""https://preview.redd.it/r6czffiroxcc1.png?width=1080&crop=smart&auto=webp&s=6ace195ce1901c6f6f7d86a01bf891c15835bfd7"", ""width"": 1080}], ""source"": {""height"": 234, ""url"": ""https://preview.redd.it/r6czffiroxcc1.png?auto=webp&s=b79b9865f35e05e38d487f2f62f9e87451f7b5bc"", ""width"": 1080}, ""variants"": {}}]",,,False,,,,[],1705468276,False,17,,,,,,,,,,,,,,,,,,,,,,,,,,,,,,,True,False,False,AIDungeon,t5_29uaei,r/AIDungeon,44876,public,,https://a.thumbs.redditmedia.com/qvY4FjItEXonHWzmnz80vj_vqOfiwp1YwucAvmbbLw8.jpg,30,140,,0,[],1705468297,https://i.redd.it/r6czffiroxcc1.png,https://i.redd.it/r6czffiroxcc1.png,[],,False,,
t3_198ppz7,The new ai’s are honestly really frickin good,"Ik we dunk on latitude a lot for having previously made some pretty incompetent and borderline idiotic decisions. But, credit where. credit is due, the new models are fucking great. I haven’t tried mythomax and I don’t remember what the free model was called, but I have honestly had better results with that free model than I have with other ai story tellers that use chatgpt as a base and especially with the old griffin model. Though I can’t say how the new models hold up compared to paid service like novelAI, since I’ve never tried them,  I’m honestly really impressed and quite excited to see what else is in store for the future. Good work latitude, I mean it, just please don’t nuder these new models like you did to griffin and dragon in the past.",28,0.94,t2_nifhle4v,/r/AIDungeon/comments/198ppz7/the_new_ais_are_honestly_really_frickin_good/,True,,,1705601442,,[],False,,,False,gweeeeeeg,,,[],,,,text,False,False,False,[],,,False,False,,False,,False,1705471830.0,20240117-061030,1705471830.0,,,self.AIDungeon,0,False,0,False,False,198ppz7,False,True,False,False,False,True,True,False,,#005ba1,,[],ab2df5da-1ac8-11ea-9c1c-0e4df316c103,Feedback & Requests,light,text,False,,,,,,,,,,,,,,,,,,,,,,,,,,,,,,,,,,,,,,,,,,,,,,,,,,,,,,,,,,,False,,,,,,,,,,,,,,,,[],True,7,0,0,False,,False,,,,"Ik we dunk on latitude a lot for having previously made some pretty incompetent and borderline idiotic decisions. But, credit where credit is due, the new models are fucking great. I haven’t tried mythomax and I don’t remember what the free model was called, but I have honestly had better results with that free model than I have with other ai story tellers that use chatgpt as a base and especially with the old griffin model. Though I can’t say how the new models hold up compared to paid service like novelAI, since I’ve never tried them,  I’m honestly really impressed and quite excited to see what else is in store for the future. Good work latitude, I mean it, just please don’t nuder these new models like you did to griffin and dragon in the past.",,False,,,,[],1705471844,False,28,,,,,,,,,,,,,,,,,,,,,,,,,,,,,,,True,False,False,AIDungeon,t5_29uaei,r/AIDungeon,44876,public,,self,,,,0,[],1705471865,https://www.reddit.com/r/AIDungeon/comments/198ppz7/the_new_ais_are_honestly_really_frickin_good/,,[],,False,,
t3_198q6o3,Help! Devs! What's this?!,Is my story screwed? It won't continue at all!,12,0.88,t2_527zhnjx,/r/AIDungeon/comments/198q6o3/help_devs_whats_this/,,,,1705603125,,[],False,,,False,Lord_Passion,,,[],,,,text,False,False,False,[],,,False,False,,False,,False,1705473513.0,20240117-063833,1705473513.0,,,i.redd.it,0,False,0,False,False,198q6o3,False,True,False,False,True,True,False,False,,#5a74cc,,[],fb19276e-9381-11ee-9eaa-2ab21dc32b0a,Bug Report,light,text,False,,,,,,,,,,,,,,,,,,,,,,,,,,,,,,,,,,,,,,,,,,,,,,,,,,,,,,,,,,,False,,,,,,,,,,,,,,,,[],True,9,0,0,False,,False,image,True,"[{""id"": ""N4JvjpB7kwjQWgT1gevCztRBPu1Xx99I5LkfKz3Zthc"", ""resolutions"": [{""height"": 38, ""url"": ""https://preview.redd.it/6vksp1jd4ycc1.png?width=108&crop=smart&auto=webp&s=db2b2acbcf8d7dc4dae4170f452419fe17de8554"", ""width"": 108}, {""height"": 77, ""url"": ""https://preview.redd.it/6vksp1jd4ycc1.png?width=216&crop=smart&auto=webp&s=e913b9f6fe6f1cbb3f700703ad5c7f3c80b0b264"", ""width"": 216}, {""height"": 114, ""url"": ""https://preview.redd.it/6vksp1jd4ycc1.png?width=320&crop=smart&auto=webp&s=c05f5a0faf8d1facf22c20fbf90a9ed56a1c8024"", ""width"": 320}, {""height"": 228, ""url"": ""https://preview.redd.it/6vksp1jd4ycc1.png?width=640&crop=smart&auto=webp&s=96c510a722c177da277fc18c32fe66eae7f894e7"", ""width"": 640}], ""source"": {""height"": 257, ""url"": ""https://preview.redd.it/6vksp1jd4ycc1.png?auto=webp&s=db99aae70320412d37a1b6fc08a702eebebf2f6a"", ""width"": 720}, ""variants"": {}}]",,,False,,,,[],1705473526,False,12,,,,,,,,,,,,,,,,,,,,,,,,,,,,,,,True,False,False,AIDungeon,t5_29uaei,r/AIDungeon,44878,public,,https://b.thumbs.redditmedia.com/K1ByF_6qZ9AhWoe8v0TIwLfjunbY7Y8ekx7RMJZVG8E.jpg,49,140,,0,[],1705473552,https://i.redd.it/6vksp1jd4ycc1.png,https://i.redd.it/6vksp1jd4ycc1.png,[],,False,,
t3_198qtze,Suggestion,There should be a way to sort from newest to oldest scenarios and vice versa. It’s annoying for the only option to be most recent,1,1.0,t2_38crxix8,/r/AIDungeon/comments/198qtze/suggestion/,,,,1705605586,,[],False,,,False,Hypedd64,,,[],,,,text,False,False,False,[],,,False,False,,False,,False,1705475973.0,20240117-071933,1705475973.0,,,self.AIDungeon,0,False,0,False,False,198qtze,False,True,False,False,False,True,True,False,,#005ba1,,[],ab2df5da-1ac8-11ea-9c1c-0e4df316c103,Feedback & Requests,light,text,False,,,,,,,,,,,,,,,,,,,,,,,,,,,,,,,,,,,,,,,,,,,,,,,,,,,,,,,,,,,False,,,,,,,,,,,,,,,,[],False,0,0,0,False,,False,,,,,,False,,,,[],1705475986,False,1,,,,,,,,,,,,,,,,,,,,,,,,,,,,,,,True,False,False,AIDungeon,t5_29uaei,r/AIDungeon,44878,public,,self,,,,0,[],1705476009,https://www.reddit.com/r/AIDungeon/comments/198qtze/suggestion/,,[],,False,,
t3_198smqr,Cursor bug is messing up my typing,"When I type, the cursor keeps shifting to the left, causing my words to get scrambled. The only way to avoid it is to type really slow, which is annoying. Is anyone else experiencing this, and is there anything I can do to fix it?",5,1,t2_pt3pj,/r/AIDungeon/comments/198smqr/cursor_bug_is_messing_up_my_typing/,,,,1705613166,,[],False,,,False,TBTabby,,,[],,,,text,False,False,False,[],,,False,False,,False,,False,1705483557,20240117-092557,1705483557,,,self.AIDungeon,0,False,0,False,False,198smqr,False,True,False,False,False,True,True,False,,#5a74cc,,[],fb19276e-9381-11ee-9eaa-2ab21dc32b0a,Bug Report,light,text,False,,,,,,,,,,,,,,,,,,,,,,,,,,,,,,,,,,,,,,,,,,,,,,,,,,,,,,,,,,,False,,,,,,,,,,,,,,,,[],False,3,0,0,False,,False,,,,,,False,,,,[],1705483580,False,5,,,,,,,,,,,,,,,,,,,,,,,,,,,,,,,True,False,False,AIDungeon,t5_29uaei,r/AIDungeon,44879,public,,self,,,,0,[],1705569965,https://www.reddit.com/r/AIDungeon/comments/198smqr/cursor_bug_is_messing_up_my_typing/,,[],,False,,
t3_1992gbx,Legacy Retirement Status,"You may have noticed we've delayed shutting down Legacy. We had some key team members out. Like many of you, we were recipients of colds and flu bugs that were exchanged, along with gifts, during the holidays. 

We also wanted to release more Phoenix improvements (like new text sizes and bug fixes) before turning off Legacy.

With our team getting back to full capacity, we're going to resume that process, and you can expect Legacy systems to start going offline over the next few days. Let us know if you have any questions! ",11,0.79,t2_ugspbkxi,/r/AIDungeon/comments/1992gbx/legacy_retirement_status/,,,,1705650786,,[],False,,,False,latitude_official,#ffb000,,[],12abe60c-938a-11ee-8572-8ad099769095,Official Account,dark,text,False,False,False,[],,,False,False,,False,,False,1705513024.0,20240117-173704,1705513024.0,,,self.AIDungeon,0,False,0,False,False,1992gbx,False,True,False,False,False,True,True,False,,#ab912b,,[],1934a3e4-9455-11ee-80d9-1aaef3318f5f,Progress Updates,dark,text,False,,,,,,,,,,,,,,,,,,,,,,,,,,,,,,,,,,,,,,,,,,,,,,,,,,,,,,,,,,,False,,,,,,,,,,,,,,,,[],True,2,0,0,False,,False,,,,,,False,,,,[],1705513035,False,11,,,,,,,,,,,,,,,,,,,,,,,,,,,,,,,True,False,False,AIDungeon,t5_29uaei,r/AIDungeon,44879,public,,self,,,,0,[],1705513060,https://www.reddit.com/r/AIDungeon/comments/1992gbx/legacy_retirement_status/,,[],,False,,
t3_1993erk,Today's Heroes Play Session Stream,"We're streaming another Heroes play session today! Tune in to see if our adventurers team up with the wandering merchant and his small menagerie of mischievous pixies, miniature dragons, and a sleepy owlbear cub...

When: 22:00 UTC

Where: [https://www.twitch.tv/latitude\_official](https://www.twitch.tv/latitude_official)

The stream will be available via Twitch video-on-demand and posted on YouTube afterward if you can't make it live. Hope you can join!

https://preview.redd.it/dunntim9k1dc1.png?width=1792&format=png&auto=webp&s=02e705721f534fb143c91e72be382b63cfa67a3e",8,0.91,t2_ugspbkxi,/r/AIDungeon/comments/1993erk/todays_heroes_play_session_stream/,True,,,1705651717,,[],False,,,False,latitude_official,#ffb000,,[],12abe60c-938a-11ee-8572-8ad099769095,Official Account,dark,text,False,False,False,[],,,False,False,,False,,False,1705515264.0,20240117-181424,1705515264.0,,,self.AIDungeon,0,False,0,False,False,1993erk,False,True,False,False,False,True,True,False,,#ff4500,,[],342f7314-9454-11ee-aef6-06152ef88161,Events,light,text,False,,"<iframe class=""embedly-embed"" src=""https://cdn.embedly.com/widgets/media.html?src=https%3A%2F%2Fplayer.twitch.tv%2F%3Fchannel%3Dlatitude_official%26muted%3Dtrue%26autoplay%3Dfalse%26parent%3Dcdn.embedly.com%26parent%3Dreddit.com%26parent%3Dwww.reddit.com%26parent%3Dold.reddit.com%26parent%3Dnew.reddit.com%26parent%3Dredditmedia.com&display_name=Twitch.tv&url=https%3A%2F%2Fwww.twitch.tv%2Flatitude_official&image=https%3A%2F%2Fstatic-cdn.jtvnw.net%2Fjtv_user_pictures%2Fd38df44b-610d-49cd-aa61-d0551dcfe1a3-profile_image-300x300.png&key=ed8fa8699ce04833838e66ce79ba05f1&type=text%2Fhtml&schema=twitch"" width=""600"" height=""340"" scrolling=""no"" title=""Twitch.tv embed"" frameborder=""0"" allow=""autoplay; fullscreen; encrypted-media; picture-in-picture;"" allowfullscreen=""true""></iframe>",340,False,600,,,,,,,,,,Image,dunntim9k1dc1,image/png,"[{""u"": ""https://preview.redd.it/dunntim9k1dc1.png?width=108&crop=smart&auto=webp&s=51f4cbef51baf022e4cccc9dcc5766b7aa07df31"", ""x"": 108, ""y"": 61}, {""u"": ""https://preview.redd.it/dunntim9k1dc1.png?width=216&crop=smart&auto=webp&s=4c45a7178fc0914113b26aa798188b97127a9c52"", ""x"": 216, ""y"": 123}, {""u"": ""https://preview.redd.it/dunntim9k1dc1.png?width=320&crop=smart&auto=webp&s=4d599443997584ca64cba9142ad05fb94219369d"", ""x"": 320, ""y"": 182}, {""u"": ""https://preview.redd.it/dunntim9k1dc1.png?width=640&crop=smart&auto=webp&s=ef1716be6d4ea5cb3a786a50aeb26ef567de81d6"", ""x"": 640, ""y"": 365}, {""u"": ""https://preview.redd.it/dunntim9k1dc1.png?width=960&crop=smart&auto=webp&s=5f23152533d5cfcc1eed28c0116237d1b4cc1326"", ""x"": 960, ""y"": 548}, {""u"": ""https://preview.redd.it/dunntim9k1dc1.png?width=1080&crop=smart&auto=webp&s=f9000e7f1036f2998ef24636a68b8a356bca2b2b"", ""x"": 1080, ""y"": 617}]",https://preview.redd.it/dunntim9k1dc1.png?width=1792&format=png&auto=webp&s=02e705721f534fb143c91e72be382b63cfa67a3e,1792,1024,valid,,,,,,,,,,,,,,,,,,,,,,,,,,,,,,,,,Latitude and AI Dungeon official Twitch channel. Subscribe for updates about Latitude games.,340,"<iframe class=""embedly-embed"" src=""https://cdn.embedly.com/widgets/media.html?src=https%3A%2F%2Fplayer.twitch.tv%2F%3Fchannel%3Dlatitude_official%26muted%3Dtrue%26autoplay%3Dfalse%26parent%3Dcdn.embedly.com%26parent%3Dreddit.com%26parent%3Dwww.reddit.com%26parent%3Dold.reddit.com%26parent%3Dnew.reddit.com%26parent%3Dredditmedia.com&display_name=Twitch.tv&url=https%3A%2F%2Fwww.twitch.tv%2Flatitude_official&image=https%3A%2F%2Fstatic-cdn.jtvnw.net%2Fjtv_user_pictures%2Fd38df44b-610d-49cd-aa61-d0551dcfe1a3-profile_image-300x300.png&key=ed8fa8699ce04833838e66ce79ba05f1&type=text%2Fhtml&schema=twitch"" width=""600"" height=""340"" scrolling=""no"" title=""Twitch.tv embed"" frameborder=""0"" allow=""autoplay; fullscreen; encrypted-media; picture-in-picture;"" allowfullscreen=""true""></iframe>",Twitch.tv,http://www.twitch.tv,300,https://static-cdn.jtvnw.net/jtv_user_pictures/d38df44b-610d-49cd-aa61-d0551dcfe1a3-profile_image-300x300.png,300,latitude_official - Twitch,rich,1.0,600,False,,,,,,,,,,,,twitch.tv,,,,[],True,0,0,0,False,,False,self,False,"[{""id"": ""VHkazvAXqH4ubpN7WOLv2rp3m7AeRWNp2QKHXTvKDnU"", ""resolutions"": [{""height"": 108, ""url"": ""https://external-preview.redd.it/iStCFFzkw2OxSdk909WFJaZVG5lgGgyHzzyKSQ_5HL0.jpg?width=108&crop=smart&auto=webp&s=aa923278c608df067222064d0770c614a0c9cef8"", ""width"": 108}, {""height"": 216, ""url"": ""https://external-preview.redd.it/iStCFFzkw2OxSdk909WFJaZVG5lgGgyHzzyKSQ_5HL0.jpg?width=216&crop=smart&auto=webp&s=692a92493faad41f992ba837630767853cbbcc0f"", ""width"": 216}], ""source"": {""height"": 300, ""url"": ""https://external-preview.redd.it/iStCFFzkw2OxSdk909WFJaZVG5lgGgyHzzyKSQ_5HL0.jpg?auto=webp&s=5602d62c86d12ca5c9b4ebcf3acc270e8c984222"", ""width"": 300}, ""variants"": {}}]","We're streaming another Heroes play session today! Tune in to see if our adventurers team up with the wandering merchant and his small menagerie of mischievous pixies, miniature dragons, and a sleepy owlbear cub...

When: 22:00 UTC

Where: [https://www.twitch.tv/latitude\_official](https://www.twitch.tv/latitude_official)

The stream will be available via Twitch video-on-demand and posted on YouTube afterward if you can't make it live. Hope you can join!

https://preview.redd.it/dunntim9k1dc1.png?width=1792&format=png&auto=webp&s=02e705721f534fb143c91e72be382b63cfa67a3e",,False,,,,[],1705515275,False,8,,"<iframe class=""embedly-embed"" src=""https://cdn.embedly.com/widgets/media.html?src=https%3A%2F%2Fplayer.twitch.tv%2F%3Fchannel%3Dlatitude_official%26muted%3Dtrue%26autoplay%3Dfalse%26parent%3Dcdn.embedly.com%26parent%3Dreddit.com%26parent%3Dwww.reddit.com%26parent%3Dold.reddit.com%26parent%3Dnew.reddit.com%26parent%3Dredditmedia.com&display_name=Twitch.tv&url=https%3A%2F%2Fwww.twitch.tv%2Flatitude_official&image=https%3A%2F%2Fstatic-cdn.jtvnw.net%2Fjtv_user_pictures%2Fd38df44b-610d-49cd-aa61-d0551dcfe1a3-profile_image-300x300.png&key=ed8fa8699ce04833838e66ce79ba05f1&type=text%2Fhtml&schema=twitch"" width=""600"" height=""340"" scrolling=""no"" title=""Twitch.tv embed"" frameborder=""0"" allow=""autoplay; fullscreen; encrypted-media; picture-in-picture;"" allowfullscreen=""true""></iframe>",340,https://www.redditmedia.com/mediaembed/1993erk,False,600,Latitude and AI Dungeon official Twitch channel. Subscribe for updates about Latitude games.,340,"<iframe class=""embedly-embed"" src=""https://cdn.embedly.com/widgets/media.html?src=https%3A%2F%2Fplayer.twitch.tv%2F%3Fchannel%3Dlatitude_official%26muted%3Dtrue%26autoplay%3Dfalse%26parent%3Dcdn.embedly.com%26parent%3Dreddit.com%26parent%3Dwww.reddit.com%26parent%3Dold.reddit.com%26parent%3Dnew.reddit.com%26parent%3Dredditmedia.com&display_name=Twitch.tv&url=https%3A%2F%2Fwww.twitch.tv%2Flatitude_official&image=https%3A%2F%2Fstatic-cdn.jtvnw.net%2Fjtv_user_pictures%2Fd38df44b-610d-49cd-aa61-d0551dcfe1a3-profile_image-300x300.png&key=ed8fa8699ce04833838e66ce79ba05f1&type=text%2Fhtml&schema=twitch"" width=""600"" height=""340"" scrolling=""no"" title=""Twitch.tv embed"" frameborder=""0"" allow=""autoplay; fullscreen; encrypted-media; picture-in-picture;"" allowfullscreen=""true""></iframe>",Twitch.tv,http://www.twitch.tv,300,https://static-cdn.jtvnw.net/jtv_user_pictures/d38df44b-610d-49cd-aa61-d0551dcfe1a3-profile_image-300x300.png,300,latitude_official - Twitch,rich,1.0,600,,,,,,,,,,,,twitch.tv,True,False,False,AIDungeon,t5_29uaei,r/AIDungeon,44879,public,,https://b.thumbs.redditmedia.com/DMCcchi6GjWnHoiW3xElxsKHrFCg8gMIrrG-ou5EaZY.jpg,140,140,,0,[],1705515297,https://www.reddit.com/r/AIDungeon/comments/1993erk/todays_heroes_play_session_stream/,,[],,False,,
t3_199bav6,Still experiencing formatting issues on the iOS app (current build of AI Dungeon),"There’s two bugs that are getting more annoying all the time, that have yet to be patched…

1; the floating pop-up label bug on ‘compact’ icons still hasn’t been squashed, when I click a button at the bottom of the screen (let’s say ‘continue’) the pop up label remains on screen, blocking the end of the output.

The labels are not needed, if a user has selected ‘compact’ buttons, we already know what they do, so adding a floating label to the button is illogical and unnecessary.

2; the “screen rotation” bug (2 versions)

2A; When the phone is (often accidentally) turned sideways far enough to activate the ‘landscape’ format, the view switches to the widescreen layout, when the phone is returned to vertical, the text displayed is only on the upper half of the display, this requires exiting the story and reloading to fix the formatting

2B; (or Not 2B ;) ); when the screen is rotated to landscape and returned to portrait, I’ve phone will either display a black screen with only the swipe up bar (iOS) at the bottom of the screen, nothing else displayed, or the version number of the app, this requires a quit and relaunch to fix the issue",1,1,t2_114pvk,/r/AIDungeon/comments/199bav6/still_experiencing_formatting_issues_on_the_ios/,True,,,1705663995,,[],False,,,False,MacTechG4,,,[],,,,text,False,False,False,[],,,False,False,,False,,False,1705534377.0,20240117-233257,1705534377.0,,,self.AIDungeon,0,False,0,False,True,199bav6,False,True,False,False,False,True,True,False,,#5a74cc,,[],fb19276e-9381-11ee-9eaa-2ab21dc32b0a,Bug Report,light,text,False,,,,,,,,,,,,,,,,,,,,,,,,,,,,,,,,,,,,,,,,,,,,,,,,,,,,,,,,,,,,,,,,,,,False,,,,,,,,,,,,,,,,[],True,0,0,0,False,,False,,,,"There’s two bugs that are getting more annoying all the time, that have yet to be patched…

1; the floating pop-up label bug on ‘compact’ icons still hasn’t been squashed, when I click a button at the bottom of the screen (let’s say ‘continue’) the pop up label remains on screen, blocking the end of the output.

The labels are not needed, if a user has selected ‘compact’ buttons, we already know what they do, so adding a floating label to the button is illogical and unnecessary.

2; the “screen rotation” bug (2 versions)

2A; When the phone is (often accidentally) turned sideways far enough to activate the ‘landscape’ format, the view switches to the widescreen layout, when the phone is returned to vertical, the text displayed is only on the upper half of the display, this requires exiting the story and reloading to fix the formatting

2B; (or Not 2B ;) ); when the screen is rotated to landscape and returned to portrait, I’ve phone will either display a black screen with only the swipe up bar (iOS) at the bottom of the screen, nothing else displayed, or the version number of the app, this requires a quit and relaunch to fix the issue",,False,,,,[],1705534389,False,1,,,,,,,,,,,,,,,,,,,,,,,,,,,,,,,True,False,False,AIDungeon,t5_29uaei,r/AIDungeon,44898,public,,self,,,,0,[],1705534412,https://www.reddit.com/r/AIDungeon/comments/199bav6/still_experiencing_formatting_issues_on_the_ios/,,[],,False,,
t3_199c189,Medieval problems remake,I am working on a medical problems remake and I wanted to know what features I should add that weren’t in the game before.,1,1.0,t2_9hyj0b59,/r/AIDungeon/comments/199c189/medieval_problems_remake/,True,,,1705665890,,[],False,,,False,Physical_Living_9392,,,[],,,,text,False,False,False,[],,,False,False,,False,,False,1705536285.0,20240118-000445,1705536285.0,,,self.AIDungeon,0,False,0,False,False,199c189,False,True,False,False,False,True,True,False,,#d3d6da,,[],13d866b0-1ace-11ea-b995-0e2090029281,Other,dark,text,False,,,,,,,,,,,,,,,,,,,,,,,,,,,,,,,,,,,,,,,,,,,,,,,,,,,,,,,,,,,,,,,,,,,False,,,,,,,,,,,,,,,,[],False,0,0,0,False,,False,,,,I am working on a medieval problems remake and I wanted to know what features I should add that weren’t in the game before.,,False,,,,[],1705536297,False,1,,,,,,,,,,,,,,,,,,,,,,,,,,,,,,,True,False,False,AIDungeon,t5_29uaei,r/AIDungeon,44880,public,,self,,,,0,[],1705536315,https://www.reddit.com/r/AIDungeon/comments/199c189/medieval_problems_remake/,,[],,False,,
t3_199i4ja,I created a Murder mystery. Enjoy,https://beta.aidungeon.com/scenario/MVXgPwh8nD4x/murder-on-the-open-waters,6,0.88,t2_7rmbqlw3,/r/AIDungeon/comments/199i4ja/i_created_a_murder_mystery_enjoy/,,,,1705683703,,[],False,,,False,The_Glam_Reaper,,,[],,,,text,False,False,False,[],,,False,False,,False,,False,1705554095.0,20240118-050135,1705554095.0,,,self.AIDungeon,0,False,0,False,False,199i4ja,False,True,False,False,False,True,True,False,,#007373,,[],3edd3e2c-9382-11ee-b76f-96885a514cbe,Scenario,light,text,False,,,,,,,,,,,,,,,,,,,,,,,,,,,,,,,,,,,,,,,,,,,,,,,,,,,,,,,,,,,,,,,,,,,False,,,,,,,,,,,,,,,,[],True,0,0,0,False,,False,self,False,"[{""id"": ""FHGyawPEfHDEUKHwh8sYhm-s0upTfvYlsFvQXC7QWRU"", ""resolutions"": [{""height"": 45, ""url"": ""https://external-preview.redd.it/wVt2nwL3UhrxCW0Co1x-DifSlrnmp2aWthY8hN2xDm8.jpg?width=108&crop=smart&auto=webp&s=cdd114b4253e8a195f9b6580cb65898ad08e398b"", ""width"": 108}, {""height"": 90, ""url"": ""https://external-preview.redd.it/wVt2nwL3UhrxCW0Co1x-DifSlrnmp2aWthY8hN2xDm8.jpg?width=216&crop=smart&auto=webp&s=fa2bd5b3bba065dec9aa58479247520e7d7198ff"", ""width"": 216}, {""height"": 133, ""url"": ""https://external-preview.redd.it/wVt2nwL3UhrxCW0Co1x-DifSlrnmp2aWthY8hN2xDm8.jpg?width=320&crop=smart&auto=webp&s=0ad83ea5700cd47dfb81241fee7b16e333a341d1"", ""width"": 320}, {""height"": 267, ""url"": ""https://external-preview.redd.it/wVt2nwL3UhrxCW0Co1x-DifSlrnmp2aWthY8hN2xDm8.jpg?width=640&crop=smart&auto=webp&s=9c5e472f4f55728b08c70a0f1c1e15c593e2f128"", ""width"": 640}, {""height"": 400, ""url"": ""https://external-preview.redd.it/wVt2nwL3UhrxCW0Co1x-DifSlrnmp2aWthY8hN2xDm8.jpg?width=960&crop=smart&auto=webp&s=f30662efc057f335b95da4a38ec9a36a687b9744"", ""width"": 960}, {""height"": 450, ""url"": ""https://external-preview.redd.it/wVt2nwL3UhrxCW0Co1x-DifSlrnmp2aWthY8hN2xDm8.jpg?width=1080&crop=smart&auto=webp&s=986e75c371029aecbdbe68682333f70fae4c854d"", ""width"": 1080}], ""source"": {""height"": 570, ""url"": ""https://external-preview.redd.it/wVt2nwL3UhrxCW0Co1x-DifSlrnmp2aWthY8hN2xDm8.jpg?auto=webp&s=2baf9d31c849a16c2a72ede201a2c8a64c2d4c5c"", ""width"": 1366}, ""variants"": {}}]",,,False,,,,[],1705554107,False,6,,,,,,,,,,,,,,,,,,,,,,,,,,,,,,,True,False,False,AIDungeon,t5_29uaei,r/AIDungeon,44879,public,,self,,,,0,[],1705554131,https://www.reddit.com/r/AIDungeon/comments/199i4ja/i_created_a_murder_mystery_enjoy/,,[],,False,,
