"all_awardings","archived","associated_award","author","author_created_utc","author_flair_background_color","author_flair_css_class","author_flair_richtext","author_flair_template_id","author_flair_text","author_flair_text_color","author_flair_type","author_fullname","author_patreon_flair","author_premium","body","can_gild","collapsed","collapsed_because_crowd_control","collapsed_reason","collapsed_reason_code","comment_type","controversiality","created_date","created_utc","distinguished","edited","gilded","id","is_submitter","link_id","locked","name","no_follow","parent_id","permalink","retrieved_on","score","score_hidden","send_replies","stickied","subreddit","subreddit_id","subreddit_name_prefixed","subreddit_type","top_awarded_type","total_awards_received","treatment_tags","unrepliable_reason"
"[]","False","None","MartianInvader2022","1672039258","None","None","[]","None","None","None","text","t2_sxnw2c9g","False","False","(If anyones wondering, I’m doing a sci fi space adventure)","True","False","None","None","None","None","0","2023-01-21-170120","1674316880","None","False","0","j5agj85","False","t3_10hufx9","False","t1_j5agj85","True","t3_10hufx9","/r/AIDungeon/comments/10hufx9/why_has_the_ai_turned_my_entry_into_a_string_of/j5agj85/","1676122746","1","False","True","False","AIDungeon","t5_29uaei","r/AIDungeon","public","None","0","[]","None",""
"[]","False","None","SaudiPhilippines","1582280979","None","None","[]","None","None","None","text","t2_5psn2xzp","False","False","AI Dungeon","True","False","None","None","None","None","0","2023-01-21-170351","1674317031","None","False","0","j5agwhq","False","t3_10hf3sh","False","t1_j5agwhq","False","t1_j584kn7","/r/AIDungeon/comments/10hf3sh/is_the_ai_just_calling_me_out/j5agwhq/","1676122737","8","False","True","False","AIDungeon","t5_29uaei","r/AIDungeon","public","None","0","[]","None",""
"[]","False","None","PavkataBrat","1516727805","None","None","[]","None","None","None","text","t2_tdttb6p","False","False","Fuck I'd be impressed more than scared. Like what if an ai knows where I live it's already on my damn phone it's not like it has a body.","True","False","None","None","None","None","0","2023-01-21-170711","1674317231","None","False","0","j5ahe49","False","t3_10h5om6","False","t1_j5ahe49","True","t1_j59d3t2","/r/AIDungeon/comments/10h5om6/latitude_please_not_again/j5ahe49/","1676122724","3","False","True","False","AIDungeon","t5_29uaei","r/AIDungeon","public","None","0","[]","None",""
"[]","False","None","MagyTheMage","1572886477","None","None","[]","None","None","None","text","t2_3mnwfjdi","False","False","Maybe he was trying to say that you smell","True","False","None","None","None","None","0","2023-01-21-175429","1674320069","None","False","0","j5aoewd","False","t3_10h5om6","False","t1_j5aoewd","False","t1_j58ibsi","/r/AIDungeon/comments/10h5om6/latitude_please_not_again/j5aoewd/","1676122547","3","False","True","False","AIDungeon","t5_29uaei","r/AIDungeon","public","None","0","[]","None",""
"[]","False","None","MagyTheMage","1572886477","None","None","[]","None","None","None","text","t2_3mnwfjdi","False","False","Nice to see latitude communication more often.

it really helps avoid a lot of problems","True","False","None","None","None","None","0","2023-01-21-175524","1674320124","None","False","0","j5aojws","False","t3_10h5om6","False","t1_j5aojws","True","t1_j56x6fa","/r/AIDungeon/comments/10h5om6/latitude_please_not_again/j5aojws/","1676122543","3","False","True","False","AIDungeon","t5_29uaei","r/AIDungeon","public","None","0","[]","None",""
"[]","False","None","MagyTheMage","1572886477","None","None","[]","None","None","None","text","t2_3mnwfjdi","False","False","Sometimes the AI will generate random shit, just generate multiple versions of the same entry and delete the bad ones","True","False","None","None","None","None","0","2023-01-21-175859","1674320339","None","False","0","j5ap3cy","False","t3_10hufx9","False","t1_j5ap3cy","True","t3_10hufx9","/r/AIDungeon/comments/10hufx9/why_has_the_ai_turned_my_entry_into_a_string_of/j5ap3cy/","1676122529","2","False","True","False","AIDungeon","t5_29uaei","r/AIDungeon","public","None","0","[]","None",""
"[]","False","None","MagyTheMage","1572886477","None","None","[]","None","None","None","text","t2_3mnwfjdi","False","False","Editting is your only choice.

Sometimes you have to butt in and manipulate the npc a little bit yourself, the AI isnt really meant to be telling the whole story on its own, its more of a helper, so sometimes you have to take things into your own hands.","True","False","None","None","None","None","0","2023-01-21-180029","1674320429","None","False","0","j5apbkz","False","t3_10hujub","False","t1_j5apbkz","True","t3_10hujub","/r/AIDungeon/comments/10hujub/how_can_i_get_more_complete_sentences_in_dialogue/j5apbkz/","1676122524","1","False","True","False","AIDungeon","t5_29uaei","r/AIDungeon","public","None","0","[]","None",""
"[]","False","None","Longjumping_Ad9072","1607061060","None","None","[]","None","None","None","text","t2_3vn5dkqh","False","False","Like the movie onward","True","False","None","None","None","None","0","2023-01-21-183854","1674322734","None","False","0","j5av4gh","False","t3_10hu6ye","False","t1_j5av4gh","True","t3_10hu6ye","/r/AIDungeon/comments/10hu6ye/looking_for_a_world/j5av4gh/","1676122374","1","False","True","False","AIDungeon","t5_29uaei","r/AIDungeon","public","None","0","[]","None",""
"[]","False","None","Foolishly_Sane","1633554477","None","None","[]","None","None","None","text","t2_f58sclgz","False","True","&gt;and while sometimes my feeling is ""Knock it off, AI!"", I am totally okay with that being a possibility. I will simply retry if the response is too foul to stomach.

Pretty much this for me, I agree.","True","False","None","None","None","None","0","2023-01-21-184001","1674322801","None","False","0","j5avaip","False","t3_10h5om6","False","t1_j5avaip","True","t1_j59i6mb","/r/AIDungeon/comments/10h5om6/latitude_please_not_again/j5avaip/","1676122370","3","False","True","False","AIDungeon","t5_29uaei","r/AIDungeon","public","None","0","[]","None",""
"[]","False","None","ToxicOwlet","1610730259","None","None","[]","None","None","None","text","t2_9u2ksgp2","False","False","Yup, something like it","True","False","None","None","None","None","0","2023-01-21-184029","1674322829","None","False","0","j5avd14","True","t3_10hu6ye","False","t1_j5avd14","True","t1_j5av4gh","/r/AIDungeon/comments/10hu6ye/looking_for_a_world/j5avd14/","1676122368","2","False","True","False","AIDungeon","t5_29uaei","r/AIDungeon","public","None","0","[]","None",""
"[]","False","None","Trashify2","1643488640","None","None","[]","None","None","None","text","t2_j5kdmwt6","False","False","Bert is a great juggler to be fair.

Also him being able to be better at throwing knives than he is at juggling might be his quirk idk, if it is that implies he is insanely good at throwing knives.","True","False","None","None","None","None","0","2023-01-21-184755","1674323275","None","False","0","j5awhga","False","t3_10c6fcg","False","t1_j5awhga","True","t3_10c6fcg","/r/AIDungeon/comments/10c6fcg/been_playing_my_hero_academia_scenario_this/j5awhga/","1676122340","1","False","True","False","AIDungeon","t5_29uaei","r/AIDungeon","public","None","0","[]","None",""
"[]","False","None","Justintime4u2bu1","1494956935","None","None","[]","None","None","None","text","t2_1amu4wg","False","False","AI be like:

OKAY FINE

“A wizard, without a gun, appears.”","True","False","None","None","None","None","0","2023-01-21-190825","1674324505","None","False","0","j5azmoa","False","t3_10h5om6","False","t1_j5azmoa","False","t1_j592dvs","/r/AIDungeon/comments/10h5om6/latitude_please_not_again/j5azmoa/","1676122260","8","False","True","False","AIDungeon","t5_29uaei","r/AIDungeon","public","None","0","[]","None",""
"[]","False","None","IsraelZulu","1378777502","None","None","[]","None","None","None","text","t2_d30ol","False","False","Like I mentioned in my edit, this seems to happen a lot when I'm trying to deliberately let the AI fill in a piece of the story, or when the AI itself has chosen to have an NPC bring up something seemingly important (but they never actually say what it is).

So, in these cases, it's really not appropriate to expect the player to take over the NPC and point it in a direction because the player themselves is, quite rightly IMO, expecting the AI to steer the conversation a bit before the player grabs the wheel again.","True","False","None","None","None","None","0","2023-01-21-191706","1674325026","None","False","0","j5b0yvf","True","t3_10hujub","False","t1_j5b0yvf","False","t1_j5apbkz","/r/AIDungeon/comments/10hujub/how_can_i_get_more_complete_sentences_in_dialogue/j5b0yvf/","1676122227","1","False","True","False","AIDungeon","t5_29uaei","r/AIDungeon","public","None","0","[]","None",""
"[]","False","None","MagyTheMage","1572886477","None","None","[]","None","None","None","text","t2_3mnwfjdi","False","False","Have you considered giving it a leading prompt?

like for example the ai brings up an NPC called bob, where he says something important has happend, you ask what and the AI dances arround the issue, thats where you can butt i and be like

Bob says ""Something terrible has happend! The....""

and leave the AI to fill the rest then redo until you get something?","True","False","None","None","None","None","0","2023-01-21-192338","1674325418","None","False","0","j5b1yjd","False","t3_10hujub","False","t1_j5b1yjd","True","t1_j5b0yvf","/r/AIDungeon/comments/10hujub/how_can_i_get_more_complete_sentences_in_dialogue/j5b1yjd/","1676122201","1","False","True","False","AIDungeon","t5_29uaei","r/AIDungeon","public","None","0","[]","None",""
"[]","False","None","IsraelZulu","1378777502","None","None","[]","None","None","None","text","t2_d30ol","False","False","The issue here is that's the kind of output I'm getting from the AI. Even if I lead it a little, it just trails off the thought in a dash or ellipsis.","True","False","None","None","None","None","0","2023-01-21-193200","1674325920","None","False","0","j5b37s0","True","t3_10hujub","False","t1_j5b37s0","True","t1_j5b1yjd","/r/AIDungeon/comments/10hujub/how_can_i_get_more_complete_sentences_in_dialogue/j5b37s0/","1676122169","1","False","True","False","AIDungeon","t5_29uaei","r/AIDungeon","public","None","0","[]","None",""
"[]","False","None","kurbocheesecake","1626813615","None","None","[]","None","None","None","text","t2_df6p1w9i","False","False","demon sex","True","False","None","None","None","None","0","2023-01-21-204032","1674330032","None","False","0","j5bd9uv","True","t3_10dnakd","False","t1_j5bd9uv","False","t1_j4qhc57","/r/AIDungeon/comments/10dnakd/that_moment_when_the_ai_just_wants_to_end_the/j5bd9uv/","1676121916","3","False","True","False","AIDungeon","t5_29uaei","r/AIDungeon","public","None","0","[]","None",""
"[]","False","None","_Ren_Ok","1666947825","None","None","[]","None","None","None","text","t2_tr7herac","False","False","Very interesting! I really ike the concept.","True","False","None","None","None","None","0","2023-01-21-204557","1674330357","None","False","0","j5be1yf","False","t3_10h77fp","False","t1_j5be1yf","True","t3_10h77fp","/r/AIDungeon/comments/10h77fp/just_made_a_new_world_and_i_want_some_feedback/j5be1yf/","1676121896","2","False","True","False","AIDungeon","t5_29uaei","r/AIDungeon","public","None","0","[]","None",""
"[]","False","None","RockstarRaccoon","1414456542","None","None","[]","None","None","None","text","t2_j2vsf","False","False","...now I'd like to know...  


Edit: Tried it on low temps.  Couldn't get anything weird.  What happened for you?","True","False","None","None","None","None","0","2023-01-21-213016","1674333016","None","1674333380.0","0","j5bki4c","False","t3_10hzoqe","False","t1_j5bki4c","False","t3_10hzoqe","/r/AIDungeon/comments/10hzoqe/never_again/j5bki4c/","1676121734","21","False","True","False","AIDungeon","t5_29uaei","r/AIDungeon","public","None","0","[]","None",""
"[]","False","None","texanretard","1609393632","None","None","[]","None","None","None","text","t2_9kyoimsb","False","False","Bro saw the dark side💀","True","False","None","None","None","None","0","2023-01-21-223000","1674336600","None","False","0","j5bt3c3","False","t3_10hzoqe","False","t1_j5bt3c3","False","t3_10hzoqe","/r/AIDungeon/comments/10hzoqe/never_again/j5bt3c3/","1676121518","28","False","True","False","AIDungeon","t5_29uaei","r/AIDungeon","public","None","0","[]","None",""
"[]","False","None","nowheresound","1565736343","None","None","[]","None","None","None","text","t2_4d43wsbm","False","False","look, Mario HAS to talk about the crypt, that's not up for negotiation.","True","False","None","None","None","None","0","2023-01-21-223905","1674337145","None","False","0","j5budft","False","t3_10fiuo9","False","t1_j5budft","True","t3_10fiuo9","/r/AIDungeon/comments/10fiuo9/from_the_same_adventure_seen_in_my_last_post/j5budft/","1676121486","1","False","True","False","AIDungeon","t5_29uaei","r/AIDungeon","public","None","0","[]","None",""
"[]","False","None","_Ren_Ok","1666947825","None","None","[]","None","None","None","text","t2_tr7herac","False","False","I was on the pixelated verison! it was basically this thing with several mouths and rows pf teeth on its head and no eyes i was on the verge of tears 😭","True","False","None","None","None","None","0","2023-01-22-001045","1674342645","None","False","0","j5c7w9g","True","t3_10hzoqe","False","t1_j5c7w9g","False","t1_j5bki4c","/r/AIDungeon/comments/10hzoqe/never_again/j5c7w9g/","1676121148","21","False","True","False","AIDungeon","t5_29uaei","r/AIDungeon","public","None","0","[]","None",""
"[]","False","None","stormwindfighter","1620571622","None","None","[]","None","None","None","text","t2_8wldgiz5","False","False","How did you do that? It is certainly interesting.","True","False","None","None","None","None","0","2023-01-22-003015","1674343815","None","False","0","j5car02","False","t3_gge07p","False","t1_j5car02","True","t3_gge07p","/r/AIDungeon/comments/gge07p/a_really_interesting_story_that_was_generated/j5car02/","1676121077","1","False","True","False","AIDungeon","t5_29uaei","r/AIDungeon","public","None","0","[]","None",""
"[]","False","None","henk717","1370363053","None","None","[]","None","None","None","text","t2_bx8b9","False","False","You don't need to change the authors notes templates. We have examples of the prompts on our discord available at https://koboldai.org/discord","True","False","None","None","None","None","0","2023-01-22-031639","1674353799","None","False","0","j5cxxio","False","t3_10i0mwl","False","t1_j5cxxio","False","t3_10i0mwl","/r/AIDungeon/comments/10i0mwl/for_kobold_ai_in_novel_mode_are_there_any/j5cxxio/","1676120499","2","False","True","False","AIDungeon","t5_29uaei","r/AIDungeon","public","None","0","[]","None",""
"[]","False","None","Acceptable_Purple_37","1635295074","None","None","[]","None","None","None","text","t2_ft8l8tol","False","False","He can do anything better than he juggles, so the more he practices juggling the better he is at doing things overall","True","False","None","None","None","None","0","2023-01-22-033444","1674354884","None","False","0","j5d0dia","False","t3_10c6fcg","False","t1_j5d0dia","True","t1_j5awhga","/r/AIDungeon/comments/10c6fcg/been_playing_my_hero_academia_scenario_this/j5d0dia/","1676120437","2","False","True","False","AIDungeon","t5_29uaei","r/AIDungeon","public","None","0","[]","None",""
"[]","False","None","Trashify2","1643488640","None","None","[]","None","None","None","text","t2_j5kdmwt6","False","False","Actually sounds like a good idea for a superpower in general.","True","False","None","None","None","None","0","2023-01-22-035854","1674356334","None","False","0","j5d3lnb","False","t3_10c6fcg","False","t1_j5d3lnb","True","t1_j5d0dia","/r/AIDungeon/comments/10c6fcg/been_playing_my_hero_academia_scenario_this/j5d3lnb/","1676120356","1","False","True","False","AIDungeon","t5_29uaei","r/AIDungeon","public","None","0","[]","None",""
"[]","False","None","RiftHunter4","1544371568","None","None","[]","None","None","None","text","t2_2r3fzc3l","False","False","Oh you should see the nightmare fuel Stable Diffusion can produce lol.","True","False","None","None","None","None","0","2023-01-22-054418","1674362658","None","False","0","j5dg9w8","False","t3_10hzoqe","False","t1_j5dg9w8","False","t1_j5c7w9g","/r/AIDungeon/comments/10hzoqe/never_again/j5dg9w8/","1676120037","13","False","True","False","AIDungeon","t5_29uaei","r/AIDungeon","public","None","0","[]","None",""
"[]","False","None","TrustSpiritual3466","1612593754","None","None","[]","None","None","None","text","t2_1428wl6t","False","False","Definitely a ongoing bug, I do believe.","True","False","None","None","None","None","0","2023-01-22-062724","1674365244","None","False","0","j5dktlz","True","t3_10gs7l0","False","t1_j5dktlz","True","t1_j58m6f6","/r/AIDungeon/comments/10gs7l0/browser_version_acting_up/j5dktlz/","1676119924","2","False","True","False","AIDungeon","t5_29uaei","r/AIDungeon","public","None","0","[]","None",""
"[]","False","None","BlakespinnerFX","1626758001","None","None","[]","None","None","None","text","t2_der8d7fx","False","False","New Creepypasta just dropped","True","False","None","None","None","None","0","2023-01-22-063458","1674365698","None","False","0","j5dll84","False","t3_10hzoqe","False","t1_j5dll84","False","t3_10hzoqe","/r/AIDungeon/comments/10hzoqe/never_again/j5dll84/","1676119905","5","False","True","False","AIDungeon","t5_29uaei","r/AIDungeon","public","None","0","[]","None",""
"[]","False","None","UrMumSuccMuch","1548537128","None","None","[]","None","None","None","text","t2_2fgcbz74","False","False","I got AI Dungeon maybe two years ago? Maybe three? I have no idea, I just remember it didn't have too many reviews on Google Play and decided to try it out because it had a beta-tester option. I had an adventure with over 2,000 inputs, and I played it nearly everyday. The energy system annoyed me but I had a workaround where I'd just leave my phone on at home so I could passively overcharge while I was at school. I wasn't really in the loop with anything as AI Dungeon rose and fell, so things were happening that I just had to get used to. I had no idea the game had blown up, I had no idea that so much was happening, all I knew was the AI was making worse and worse generations and I basically have to go and edit every input to get any coherent event now. It's premium was getting more and more added, now there were different AI models which I could never access because of premium, then premium was split into different forms, then I saw special currency which really worried me, and god the game itself, even on browser, is so laggy, unresponsive, slow. Things will load then collapse on their own, it'll take half a minute to open a scenario or world page just to check it out, the AI itself will take years to respond, and even when it does it doesn't give a good response. Sometimes it'll just duplicate my command for whatever reason, or copy-paste what my command says into a response. It was really disheartening seeing the game become so glitchy and in some cases terrible. And when I finally decided to figure out why, I got even more sad over all the controversy because the game was so good, I miss it so much. I still play it on and off while trying to find other games that satisfy my itch, but I'm going to have to drop it soon enough.

Loved the game, wish I stood in the loop of things so I could back the fanbase when I could, and it's kind of hard to uninstall the game since I've had so much fun with it.","True","False","None","None","None","None","0","2023-01-22-072415","1674368655","None","False","0","j5dqalh","False","t3_xzt0gb","False","t1_j5dqalh","True","t1_irp2iqo","/r/AIDungeon/comments/xzt0gb/this_sub_has_made_me_question_my_enjoyment_of_ai/j5dqalh/","1676119787","2","False","True","False","AIDungeon","t5_29uaei","r/AIDungeon","public","None","0","[]","None",""
"[]","False","None","Giodude12","1424548142","None","None","[]","None","None","None","text","t2_li8p3","False","False","Yo show it","True","False","None","None","None","None","0","2023-01-22-081233","1674371553","None","False","0","j5ducpa","False","t3_10hzoqe","False","t1_j5ducpa","False","t3_10hzoqe","/r/AIDungeon/comments/10hzoqe/never_again/j5ducpa/","1676119685","10","False","True","False","AIDungeon","t5_29uaei","r/AIDungeon","public","None","0","[]","None",""
"[]","False","None","jackyboyman13","1546899998","None","None","[]","None","None","None","text","t2_2xun1szj","False","False","Yeah. I just hope that things get better from here and the bug problem gets solved. Knock on wood.","True","False","None","None","None","None","0","2023-01-22-085532","1674374132","None","False","0","j5dxo2y","False","t3_10gs7l0","False","t1_j5dxo2y","True","t1_j5dktlz","/r/AIDungeon/comments/10gs7l0/browser_version_acting_up/j5dxo2y/","1676119603","2","False","True","False","AIDungeon","t5_29uaei","r/AIDungeon","public","None","0","[]","None",""
"[]","False","None","RoyfromFireEmblem","1569894214","None","None","[]","None","None","None","text","t2_4pasc3s5","False","False","Please add goku","True","False","None","None","None","None","0","2023-01-22-091442","1674375282","None","False","0","j5dz3be","False","t3_zk7xmj","False","t1_j5dz3be","True","t3_zk7xmj","/r/AIDungeon/comments/zk7xmj/ai_dungeon_unchained_release_is_now_live_link_to/j5dz3be/","1676119568","1","False","True","False","AIDungeon","t5_29uaei","r/AIDungeon","public","None","0","[]","None",""
"[]","False","None","Hero_Of_Shadows","1481266508","None","None","[]","None","None","None","text","t2_13fjr0","False","False","Thanks so no need to change the template, got it.","True","False","None","None","None","None","0","2023-01-22-103259","1674379979","None","False","0","j5e4s8k","True","t3_10i0mwl","False","t1_j5e4s8k","True","t1_j5cxxio","/r/AIDungeon/comments/10i0mwl/for_kobold_ai_in_novel_mode_are_there_any/j5e4s8k/","1676119426","1","False","True","False","AIDungeon","t5_29uaei","r/AIDungeon","public","None","0","[]","None",""
"[]","False","None","_Ren_Ok","1666947825","None","None","[]","None","None","None","text","t2_tr7herac","False","False","Curiosity killed the cat but I'm a human being I shouldn't be bothered right?","True","False","None","None","None","None","0","2023-01-22-154320","1674398600","None","False","0","j5evo9j","True","t3_10hzoqe","False","t1_j5evo9j","False","t1_j5dg9w8","/r/AIDungeon/comments/10hzoqe/never_again/j5evo9j/","1676118756","3","False","True","False","AIDungeon","t5_29uaei","r/AIDungeon","public","None","0","[]","None",""
"[]","False","None","aidenethan","1545775228","None","None","[]","None","None","None","text","t2_2uw4u65u","False","False","It should be in settings I think","True","False","None","None","None","None","0","2023-01-22-173516","1674405316","None","False","0","j5fb173","False","t3_10ic5wu","False","t1_j5fb173","True","t3_10ic5wu","/r/AIDungeon/comments/10ic5wu/how_do_i_turn_off_images_on_mobile/j5fb173/","1676118371","1","False","True","False","AIDungeon","t5_29uaei","r/AIDungeon","public","None","0","[]","None",""
"[]","False","None","MuskyRatt","1533668720","None","None","[]","None","None","None","text","t2_1xt4uofi","False","False","Was this the first seizure you’ve had, or is it an ongoing medical issue?","True","False","None","None","None","None","0","2023-01-22-174830","1674406110","None","False","0","j5fczr5","False","t3_10hzoqe","False","t1_j5fczr5","True","t3_10hzoqe","/r/AIDungeon/comments/10hzoqe/never_again/j5fczr5/","1676118322","1","False","True","False","AIDungeon","t5_29uaei","r/AIDungeon","public","None","0","[]","None",""
"[]","False","None","InkyDaint","1665795847","None","None","[]","None","None","None","text","t2_oxfug3aw","False","False","I am definitely taking this advice. I was very interested in AI Dungeon. I will still try it out but I will test out the options you provided above and check to see if your claims are true.","True","False","None","None","None","None","0","2023-01-22-191117","1674411077","None","False","0","j5fpqxj","False","t3_xzt0gb","False","t1_j5fpqxj","True","t1_irwro3g","/r/AIDungeon/comments/xzt0gb/this_sub_has_made_me_question_my_enjoyment_of_ai/j5fpqxj/","1676118006","1","False","True","False","AIDungeon","t5_29uaei","r/AIDungeon","public","None","0","[]","None",""
"[]","False","None","TinyArm2","1577826845","None","None","[]","None","None","None","text","t2_5cbzzdw4","False","False","The bot isn't in the ARG, but I think the author has incorporated it.","True","False","None","None","None","None","0","2023-01-22-232108","1674426068","None","False","0","j5gt3a9","False","t3_10iw1k9","False","t1_j5gt3a9","True","t3_10iw1k9","/r/AIDungeon/comments/10iw1k9/opinions_on_this_arg/j5gt3a9/","1676117032","1","False","True","False","AIDungeon","t5_29uaei","r/AIDungeon","public","None","0","[]","None",""
"[]","False","None","PikeldeoAcedia","1618486137","None","None","[]","None","None","None","text","t2_bjxon9zg","False","False","It specifically mentions using GPT-J 6B. AID doesn't use GPT-J 6B (although it *did* to from late 2021 to early 2022).

Edit: I might've misinterpreted the comment. By ""the bot"", are you referring to AID (the way I interpreted it), or the bot in the ARG?","True","False","None","None","None","None","0","2023-01-23-000645","1674428805","None","1674429165.0","0","j5h0ayi","False","t3_10iw1k9","False","t1_j5h0ayi","True","t1_j5gt3a9","/r/AIDungeon/comments/10iw1k9/opinions_on_this_arg/j5h0ayi/","1676116854","1","False","True","False","AIDungeon","t5_29uaei","r/AIDungeon","public","None","0","[]","None",""
