"all_awardings","archived","associated_award","author","author_created_utc","author_flair_background_color","author_flair_css_class","author_flair_richtext","author_flair_template_id","author_flair_text","author_flair_text_color","author_flair_type","author_fullname","author_patreon_flair","author_premium","body","can_gild","collapsed","collapsed_because_crowd_control","collapsed_reason","collapsed_reason_code","comment_type","controversiality","created_date","created_utc","distinguished","edited","gilded","id","is_submitter","link_id","locked","name","no_follow","parent_id","permalink","retrieved_on","score","score_hidden","send_replies","stickied","subreddit","subreddit_id","subreddit_name_prefixed","subreddit_type","top_awarded_type","total_awards_received","treatment_tags","unrepliable_reason"
"[]","False","None","chrismcelroyseo","1407684607","None","None","[]","None","None","None","text","t2_hta1m","False","False","It would be nice if you could do all of that, but I don't think anybody's made an AI they can really do that yet. I've had d AI dungeons highest tier and novel ai's highest tier and I've tried out the other ones.

Novel AI has come the closest for me as far as inventory, remembering what weapons I use and that sort of thing. But even then it has me pull a gun out every now and then when guns weren't invented in the world that I'm playing in.","True","False","None","None","None","None","0","2023-01-01-014207","1672533727","None","False","0","j2g38ke","False","t3_1006uda","False","t1_j2g38ke","False","t3_1006uda","/r/AIDungeon/comments/1006uda/newbie_needing_help_adapting_to_this_style_of_game/j2g38ke/","1673021507","4","False","True","False","AIDungeon","t5_29uaei","r/AIDungeon","public","None","0","[]","None"
"[]","False","None","winterdasu","1446190325","None","None","[]","None","None","None","text","t2_rl53j","False","False","The heart of your issue comes from thinking of AI Dungeon -- as well as similar competitors -- as games. They truly aren't games in a traditional sense. They are writing assistants or creative exercises.

While AI Dungeon has a text adventure mode, that's just a framework laid over a predictive text AI. It's a system of rules that we've imposed on ourselves alone. The AI model doesn't know or care that you're trying to play a game with rules or a goal in mind. It simply sees a sentence like ""The sky is"" and knows that the most likely word to come next is ""blue.""

So the answer to #1 is that there are no hard limits on what your character is allowed to do, or what items or abilities they have. You get to decide that. The AI literally isn't keeping track of it, and beyond a certain point, it can't even 'remember' the beginning of the story.

For #2, AI Dungeon also gives you the tools to add manually to the story text without it being a player action. If you want some more detail about a location (and you don't want to make it up yourself) try adding a sentence like ""The building was designed in a neo-classical style and"" and let the AI take over describing.

For #3, as I said above, the AI is just predicting what words should come next. Any actions it takes with your character were simply a consequence of that. You have the freedom to overwrite those actions with text of your own.

And really, I encourage you to take as active of a role as you can in the story telling process. Writing tools like AI Dungeon are truly at their best when you, as the player, inject your ideas into the story. AI has no idea what makes a good or interesting story, it has no idea what an arc or a theme is. It can write pretty prose and come up with some interesting concepts, but it needs a human to link it all together into a full story.","True","False","None","None","None","None","0","2023-01-01-015140","1672534300","None","1672534528.0","0","j2g4i2q","False","t3_1006uda","False","t1_j2g4i2q","False","t3_1006uda","/r/AIDungeon/comments/1006uda/newbie_needing_help_adapting_to_this_style_of_game/j2g4i2q/","1673021473","16","False","True","False","AIDungeon","t5_29uaei","r/AIDungeon","public","None","0","[]","None"
"[]","False","None","IsraelZulu","1378777502","None","None","[]","None","None","None","text","t2_d30ol","False","False","For #2 in particular, can you share more details (or point you useful resources) about the tools I could use for this? I know you suggested feeding the AI more prompts, but is there something I could do through Memory or World Info to help the AI need less of the direct prompting? I've tried using both features for various other things so far, with fairly little success - I'm honestly not sure I'm doing it right, and some things just seem to not work as expected at all.","True","False","None","None","None","None","0","2023-01-01-015937","1672534777","None","False","0","j2g5jdn","True","t3_1006uda","False","t1_j2g5jdn","True","t1_j2g4i2q","/r/AIDungeon/comments/1006uda/newbie_needing_help_adapting_to_this_style_of_game/j2g5jdn/","1673021446","3","False","True","False","AIDungeon","t5_29uaei","r/AIDungeon","public","None","0","[]","None"
"[]","False","None","Yeeting-Boi","1540801845","None","None","[]","None","None","None","text","t2_2i0q3oa7","False","False","I think the “story” action is what they’re referring to. You can use it like a look command with a bit of input. For example, you could write “You look outside at the busy streets. There is a group of people that are” and let the AI continue from there. Or you can manually edit the AI’s outputs to steer the story in the right direction if it consistently doesn’t work well.","True","False","None","None","None","None","0","2023-01-01-021154","1672535514","None","False","0","j2g792v","False","t3_1006uda","False","t1_j2g792v","False","t1_j2g5jdn","/r/AIDungeon/comments/1006uda/newbie_needing_help_adapting_to_this_style_of_game/j2g792v/","1673021401","4","False","True","False","AIDungeon","t5_29uaei","r/AIDungeon","public","None","0","[]","None"
"[]","False","None","IsraelZulu","1378777502","None","None","[]","None","None","None","text","t2_d30ol","False","False","Yeah, I took your prompting idea and quickly realized the Story action would be the right way to use it.

Are there any ways the Memory or WI features could also be useful here?","True","False","None","None","None","None","0","2023-01-01-021405","1672535645","None","False","0","j2g7j2g","True","t3_1006uda","False","t1_j2g7j2g","True","t1_j2g792v","/r/AIDungeon/comments/1006uda/newbie_needing_help_adapting_to_this_style_of_game/j2g7j2g/","1673021393","2","False","True","False","AIDungeon","t5_29uaei","r/AIDungeon","public","None","0","[]","None"
"[]","False","None","Compguy321","1574220455","None","None","[]","None","None","None","text","t2_51yzigjs","False","False","Inventory - You can say you use things in your inventory that you mentally keep track of, or write down, etc...  For example, set the action button to ""do"", then enter ""You draw your sword and swing at the enemy"", or ""You drink a healing potion"", etc...  You can also put your inventory into memory.

Observing the world - Set the action button to ""do"", then enter ""you observe your surroundings"", ""you look off into the distance"", etc...  You can even steer it, like ""you see a hut in the distance and observe its details.  You can also do See (may be a premium feature), and copy / paste and edit the AI's description of what you see to get an actual picture of what you see.

Controlling the character - If you wish to talk, change the action button to ""say"" then just type what you say.  If you wish to do something, change it to ""do"", then type what you do, e.g. walk down a path, fight an enemy, etc... You can do pretty much anything, although the AI might say you can't (e.g. if you are a knight and you try to fly, the AI might just say you jump).  If you are a mage, or Superman, etc... you probably would be able to fly.","True","False","None","None","None","None","0","2023-01-01-021942","1672535982","None","1672536164.0","0","j2g89g3","False","t3_1006uda","False","t1_j2g89g3","True","t3_1006uda","/r/AIDungeon/comments/1006uda/newbie_needing_help_adapting_to_this_style_of_game/j2g89g3/","1673021373","2","False","True","False","AIDungeon","t5_29uaei","r/AIDungeon","public","None","0","[]","None"
"[]","False","None","winterdasu","1446190325","None","None","[]","None","None","None","text","t2_rl53j","False","False","The AI Dungeon wiki really has all you need to know about world info: [Here](https://wiki.aidungeon.io/wiki/World_Info)

Getting the keys for each entry set up and making the entries really strongly worded is the most important step. Others may say that there are other, better ways to format world info text, but in my experience it's a lot of extra work for very little benefit.

The truth is, if you have a strong idea of a story you want to play, you're going to have to do a lot of micromanaging to get the AI to fall in line. Once you've built up enough context through editing the story and adding your own details, the AI may get into a groove with you. A lot of the time it won't.

The other half of that truth is that you shouldn't expect the AI to have a strong idea of what the story is, or even a consistent idea about what a location or person looks like. It's making it all up on the fly, and even every time you hit retry it re-invents whatever is happening from the context of the rest of the text.

I used to use AI Dungeon and Novel AI all the time, but I've recently just gone back to writing all by my lonesome because I realized I was spending more time writing prompts and editing responses than actually using the AI.","True","False","None","None","None","None","0","2023-01-01-022032","1672536032","None","1672536224.0","0","j2g8db5","False","t3_1006uda","False","t1_j2g8db5","True","t1_j2g5jdn","/r/AIDungeon/comments/1006uda/newbie_needing_help_adapting_to_this_style_of_game/j2g8db5/","1673021370","3","False","True","False","AIDungeon","t5_29uaei","r/AIDungeon","public","None","0","[]","None"
"[]","False","None","Yeeting-Boi","1540801845","None","None","[]","None","None","None","text","t2_2i0q3oa7","False","False","Sorry, but I really don’t know much about using memory or WI. I mostly use memory for clarifying details the AI can’t get straight rather than using it as an inventory system. So, if the AI kept saying I had a sword when I only had a staff, I would just write in memory “You do not have a sword” and it seems to remember.

World Info is something I’ve only touched once, and is more useful for broader pieces of memory such as cities or kingdoms or, in some cases, magical abilities that need to be important for the whole story. The best example I can remember of this is in the Kedar world where WI is used to describe races.

This might not be accurate though because I hardly use it. Hope it somewhat helped though!","True","False","None","None","None","None","0","2023-01-01-022718","1672536438","None","False","0","j2g97pq","False","t3_1006uda","False","t1_j2g97pq","True","t1_j2g7j2g","/r/AIDungeon/comments/1006uda/newbie_needing_help_adapting_to_this_style_of_game/j2g97pq/","1673021347","3","False","True","False","AIDungeon","t5_29uaei","r/AIDungeon","public","None","0","[]","None"
"[]","False","None","IsraelZulu","1378777502","None","None","[]","None","None","None","text","t2_d30ol","False","False","You response to 1 is more or less what I've already covered in my post. It still leaves unaddressed the problem of ascertaining your status at the start of a game.

What you've given for 2 is some useful information. Thanks. I've actually been a little curious about the ""See"" feature, even though I haven't gotten credits to try it yet. Is the AI smart enough to generate the image prompt itself, or do you have to provide all the details from scratch? Like, if the AI has given you details about Gandalf (probably spread across several responses), could you just use `/see Gandalf` to get an appropriate image, or do you still have to plug all those details in manually?

As for 3: I've gotten pretty used to taking player actions myself. My complaint is when the AI response makes my character say or do something I didn't ask for. It would be nice if there was a way to at least adjust that.","True","False","None","None","None","None","0","2023-01-01-022828","1672536508","None","False","0","j2g9cyv","True","t3_1006uda","False","t1_j2g9cyv","True","t1_j2g89g3","/r/AIDungeon/comments/1006uda/newbie_needing_help_adapting_to_this_style_of_game/j2g9cyv/","1673021343","2","False","True","False","AIDungeon","t5_29uaei","r/AIDungeon","public","None","0","[]","None"
"[]","False","None","IsraelZulu","1378777502","None","None","[]","None","None","None","text","t2_d30ol","False","False","I've skimmed the wiki and some other resources about Memory and WI, but some things still aren't working exactly as I'd expect.

I think I've more or less got a grasp on Memory. But WI either flat out doesn't work or I'm doing something wrong.

I haven't tried building Scenarios or Worlds from scratch yet. So far I've just been modifying my own Adventures, after starting from a Scenario built by someone else. Any time I've tried to add WI, the AI puts in its own flavoring to it. Any edits I make to that don't seem to stick. Any time I manually create an entry, it stays blank.

Note: I'm playing via the Android app.","True","False","None","None","None","None","0","2023-01-01-024235","1672537355","None","False","0","j2gb57i","True","t3_1006uda","False","t1_j2gb57i","False","t1_j2g8db5","/r/AIDungeon/comments/1006uda/newbie_needing_help_adapting_to_this_style_of_game/j2gb57i/","1673021295","2","False","True","False","AIDungeon","t5_29uaei","r/AIDungeon","public","None","0","[]","None"
"[]","False","None","Puzzleheaded_Pitch26","1596960466","None","None","[]","None","None","None","text","t2_5q1et38d","False","False","Just as an update in case anyone reads this, it is now possible to save progress, the only issue is the severe censorship.","True","False","None","None","None","None","0","2023-01-01-024922","1672537762","None","False","0","j2gbzyh","False","t3_zavedv","False","t1_j2gbzyh","True","t1_izvi5rb","/r/AIDungeon/comments/zavedv/how_does_ai_dungeon_dragon_compare_to_novelai_and/j2gbzyh/","1673021272","1","False","True","False","AIDungeon","t5_29uaei","r/AIDungeon","public","None","0","[]","None"
"[]","False","None","Some_Loquat","1586892768","None","None","[]","None","None","None","text","t2_67rkvo3p","False","False","At the moment it's still trivial to bypass the censorship by gasligthing the model.

 I'd say the biggest flaw rn is the rate limit, can only use it so long before getting the ""Too many requests in 1 hour"" message.","True","False","None","None","None","None","0","2023-01-01-030103","1672538463","None","False","0","j2gdgli","False","t3_zavedv","False","t1_j2gdgli","True","t1_j2gbzyh","/r/AIDungeon/comments/zavedv/how_does_ai_dungeon_dragon_compare_to_novelai_and/j2gdgli/","1673021232","1","False","True","False","AIDungeon","t5_29uaei","r/AIDungeon","public","None","0","[]","None"
"[]","False","None","ominousgraycat","1429568646","None","None","[]","None","None","None","text","t2_n12i0","False","False","I don't really view AI dungeon as a normal game, I view it more like cooperative story telling with an AI. I frequently edit AI responses if they're way off base. I usually do have one character I'm playing more than I'm playing the rest, but I do sometimes make another character respond appropriately.

Also, if the AI is spinning its wheels, is stuck in a rut, or just ignoring something I really think should be acknowledged, I sometimes switch to story mode and write, ""X looks at the sword in your hand and says"" to force the AI to say something relevant.","True","False","None","None","None","None","0","2023-01-01-052935","1672547375","None","False","0","j2guedu","False","t3_1006uda","False","t1_j2guedu","True","t3_1006uda","/r/AIDungeon/comments/1006uda/newbie_needing_help_adapting_to_this_style_of_game/j2guedu/","1673020771","1","False","True","False","AIDungeon","t5_29uaei","r/AIDungeon","public","None","0","[]","None"
"[]","False","None","AoFAltair","1287456003","None","None","[]","None","None","None","text","t2_4fwiv","False","False","Katie Morgan?","True","False","None","None","None","None","0","2023-01-01-062632","1672550792","None","False","0","j2h06f3","False","t3_100bsff","False","t1_j2h06f3","True","t3_100bsff","/r/AIDungeon/comments/100bsff/what_the_fck_aid/j2h06f3/","1673020613","3","False","True","False","AIDungeon","t5_29uaei","r/AIDungeon","public","None","0","[]","None"
"[]","False","None","intuitive-arts","1654955182","None","None","[]","None","None","None","text","t2_n5psyawl","False","False","I have not tried it, but you may write a worldinfo entry for inventory, and edit it when you take or drop things.","True","False","None","None","None","None","0","2023-01-01-070915","1672553355","None","False","0","j2h45zm","False","t3_1006uda","False","t1_j2h45zm","True","t3_1006uda","/r/AIDungeon/comments/1006uda/newbie_needing_help_adapting_to_this_style_of_game/j2h45zm/","1673020503","1","False","True","False","AIDungeon","t5_29uaei","r/AIDungeon","public","None","0","[]","None"
"[]","False","None","SlightlyIronicBanana","1587485738","None","None","[]","None","None","None","text","t2_69qadggq","False","False","You've never eaten donkey before?","True","False","None","None","None","None","0","2023-01-01-073000","1672554600","None","False","0","j2h5yyf","False","t3_100bsff","False","t1_j2h5yyf","False","t3_100bsff","/r/AIDungeon/comments/100bsff/what_the_fck_aid/j2h5yyf/","1673020452","18","False","True","False","AIDungeon","t5_29uaei","r/AIDungeon","public","None","0","[]","None"
"[]","False","None","anar1ston","1671647060","None","None","[]","None","None","None","text","t2_uvip6xo3","False","False","Certified AI Dungeon moment","True","False","None","None","None","None","0","2023-01-01-104614","1672566374","None","False","0","j2hk34b","False","t3_100bsff","False","t1_j2hk34b","False","t3_100bsff","/r/AIDungeon/comments/100bsff/what_the_fck_aid/j2hk34b/","1676035036","23","False","True","False","AIDungeon","t5_29uaei","r/AIDungeon","public","None","0","[]","None"
"[]","False","None","Random-Guy-1024","1639749444","None","None","[]","None","None","None","text","t2_h0u2t9f4","False","False","Haha, I can tell you're new, you have no idea what it feels like to be concentrating on a story, with music playing in the background, maybe managing an army or fighting with magic in a battle and then the AI puts you in a coffee shop drinking tea with a guy named Donkey.","True","False","None","None","None","None","0","2023-01-01-120308","1672570988","None","False","0","j2hp0yd","False","t3_1006uda","False","t1_j2hp0yd","True","t3_1006uda","/r/AIDungeon/comments/1006uda/newbie_needing_help_adapting_to_this_style_of_game/j2hp0yd/","1676034904","2","False","True","False","AIDungeon","t5_29uaei","r/AIDungeon","public","None","0","[]","None"
"[]","False","None","FKaria","1318283212","None","None","[]","None","None","None","text","t2_60md5","False","False","AID is not a game or a DM in the way that you expect and never will be. 

AID just writes wathever text thinks should follow from the context it was given. 

It can't do logic reasoning, it can't guarantee a consistent story it can't keep track of things not in the context. Even things that are in the context are just suggestions and the AI will usually improvise or ignore things randomly.

The way to better enjoy AID is to treat it as a writing assistant. You're writing half the story and the AI is writing the other half. 

Switch to story mode and write ""You look around and see"" don't finish the sentence, don't put a period. Let the AI take over. That's how it will tell you what's around. 

Anything you want the AI to remember put it in memory or in world. Just put essential details that are important to the story. Forget about physical descriptions, inventory or anything that doesn't add any drama because it just eats up valuable context space, which is very limited.","True","False","None","None","None","None","0","2023-01-01-120806","1672571286","None","False","0","j2hpct8","False","t3_1006uda","False","t1_j2hpct8","True","t3_1006uda","/r/AIDungeon/comments/1006uda/newbie_needing_help_adapting_to_this_style_of_game/j2hpct8/","1676034894","1","False","True","False","AIDungeon","t5_29uaei","r/AIDungeon","public","None","0","[]","None"
"[]","False","None","FKaria","1318283212","None","None","[]","None","None","None","text","t2_60md5","False","False","Make sure the world entries are enabled. You can wlays check the input to the AI to see what is being fed into it. Make the entries as short as possible because context is limited.","True","False","None","None","None","None","0","2023-01-01-121149","1672571509","None","False","0","j2hplds","False","t3_1006uda","False","t1_j2hplds","False","t1_j2gb57i","/r/AIDungeon/comments/1006uda/newbie_needing_help_adapting_to_this_style_of_game/j2hplds/","1676034888","2","False","True","False","AIDungeon","t5_29uaei","r/AIDungeon","public","None","0","[]","None"
"[]","False","None","Revolutionaryguardp","1653023173","None","None","[]","None","None","None","text","t2_jyr7e7oq","False","False","Oh boy, how fun","True","False","None","None","None","None","0","2023-01-01-122624","1672572384","None","False","0","j2hqj8t","False","t3_100d3rr","False","t1_j2hqj8t","True","t3_100d3rr","/r/AIDungeon/comments/100d3rr/i_cant_believe_it_its_him/j2hqj8t/","1676034862","2","False","True","False","AIDungeon","t5_29uaei","r/AIDungeon","public","None","0","[]","None"
"[]","False","None","4the10th","1609296670","None","None","[]","None","None","None","text","t2_37q0d2sx","False","False","""Depressed about falling"" is one of the best phrases I have *ever* heard.","True","False","None","None","None","None","0","2023-01-01-134600","1672577160","None","False","0","j2hvznv","False","t3_zxz8r2","False","t1_j2hvznv","False","t3_zxz8r2","/r/AIDungeon/comments/zxz8r2/death_speedrun/j2hvznv/","1676034715","4","False","True","False","AIDungeon","t5_29uaei","r/AIDungeon","public","None","0","[]","None"
"[]","False","None","chrismcelroyseo","1407684607","None","None","[]","None","None","None","text","t2_hta1m","False","True","Well? Have you?","True","False","None","None","None","None","0","2023-01-01-162504","1672586704","None","False","0","j2ibid3","False","t3_100bsff","False","t1_j2ibid3","False","t3_100bsff","/r/AIDungeon/comments/100bsff/what_the_fck_aid/j2ibid3/","1676034253","12","False","True","False","AIDungeon","t5_29uaei","r/AIDungeon","public","None","0","[]","None"
"[]","False","None","brun0caesar","1577282412","None","None","[]","None","None","None","text","t2_5arwfmne","False","False","What did she said???","True","False","None","None","None","None","0","2023-01-01-194920","1672598960","None","False","0","j2j3wnf","False","t3_100bsff","False","t1_j2j3wnf","True","t3_100bsff","/r/AIDungeon/comments/100bsff/what_the_fck_aid/j2j3wnf/","1676213833","3","False","True","False","AIDungeon","t5_29uaei","r/AIDungeon","public","None","0","[]","None"
"[]","False","None","Professional-Put-535","1601359008","None","None","[]","None","None","None","text","t2_89xis4c1","False","False","Ai be wildin'...

It's actually at moments like that where sometimes I go along with whatever nonsense the AI generated and talk directly to it in Parentheses mid-story

E.G: (What the hell, Ai?)","True","False","None","None","None","None","0","2023-01-01-201817","1672600697","None","False","0","j2j8gc5","False","t3_100bsff","False","t1_j2j8gc5","False","t3_100bsff","/r/AIDungeon/comments/100bsff/what_the_fck_aid/j2j8gc5/","1676213715","8","False","True","False","AIDungeon","t5_29uaei","r/AIDungeon","public","None","0","[]","None"
