name,title,selftext,ups,upvote_ratio,author_fullname,permalink,_meta_note,all_awardings,allow_live_comments,approved_at_utc,approved_by,archived,author,author_flair_background_color,author_flair_css_class,author_flair_richtext,author_flair_template_id,author_flair_text,author_flair_text_color,author_flair_type,author_is_blocked,author_patreon_flair,author_premium,awarders,banned_at_utc,banned_by,can_gild,can_mod_post,category,clicked,content_categories,contest_mode,created,created-date,created_utc,discussion_type,distinguished,domain,downs,edited,gilded,hidden,hide_score,id,is_created_from_ads_ui,is_crosspostable,is_meta,is_original_content,is_reddit_media_domain,is_robot_indexable,is_self,is_video,likes,link_flair_background_color,link_flair_css_class,link_flair_richtext,link_flair_template_id,link_flair_text,link_flair_text_color,link_flair_type,locked,media,media_only,mod_note,mod_reason_by,mod_reason_title,mod_reports,no_follow,num_comments,num_crossposts,num_reports,over_18,parent_whitelist_status,pinned,pwls,quarantine,removal_reason,removed_by,removed_by_category,report_reasons,retrieved_on,saved,score,secure_media,send_replies,spoiler,stickied,subreddit,subreddit_id,subreddit_name_prefixed,subreddit_subscribers,subreddit_type,suggested_sort,thumbnail,thumbnail_height,thumbnail_width,top_awarded_type,total_awards_received,treatment_tags,updated_on,url,user_reports,view_count,visited,whitelist_status,wls
t3_18vp4xl,How would people describe the new GPT-esque model they have?,"Is it good?

Or should i stick with Dragon?",1,1.0,t2_x15n0wz,/r/AIDungeon/comments/18vp4xl/how_would_people_describe_the_new_gptesque_model/,no_2nd_retrieval,[],False,,,False,EndorDerDragonKing,,,[],,,,text,False,False,False,[],,,False,False,,False,,False,1704084063.0,20240101-044103,1704084063.0,,,self.AIDungeon,0,False,0,False,True,18vp4xl,False,True,False,False,False,True,True,False,,#349e48,,[],ae468a20-1ac8-11ea-af43-0effba01f5bd,Questions,dark,text,False,,False,,,,[],True,5,0,0,False,,False,,False,,,,[],1704084084,False,1,,True,False,False,AIDungeon,t5_29uaei,r/AIDungeon,44907,public,,self,,,,0,[],1704084094,https://www.reddit.com/r/AIDungeon/comments/18vp4xl/how_would_people_describe_the_new_gptesque_model/,[],,False,,
t3_18vqrjj,Something I love,I like to ask character to tell a joke or put in their cards that they are funny but the ai doesnt seem to quite understand humor. I recommend giving it a try because its lack of humor is funny. The jokes usually go something like this: what do you call a dinosaur that never smiles? A grumpy dinosaur. I just find it silly that it does this and I rather enjoy it. Just wanted to share,1,1.0,t2_97s1saty,/r/AIDungeon/comments/18vqrjj/something_i_love/,no_2nd_retrieval,[],False,,,False,Most-Environment-214,,,[],,,,text,False,False,False,[],,,False,False,,False,,False,1704090504.0,20240101-062824,1704090504.0,,,self.AIDungeon,0,False,0,False,True,18vqrjj,False,True,False,False,False,True,True,False,,#005ba1,,[],ab2df5da-1ac8-11ea-9c1c-0e4df316c103,Feedback & Requests,light,text,False,,False,,,,[],True,3,0,0,False,,False,,False,,,,[],1704090519,False,1,,True,False,False,AIDungeon,t5_29uaei,r/AIDungeon,44907,public,,self,,,,0,[],1704090538,https://www.reddit.com/r/AIDungeon/comments/18vqrjj/something_i_love/,[],,False,,
t3_18vs67c,Anyone else feel like they lobotomized griffin just to show how much better the new AI is?,"I mean it was repeating the same exact paragraph verbatim when describing my actions, and after 14 minutes of being annoyed I switch to the new one and it magically stops.

Don't get me wrong the new AI is still leaps and bounds above normal griffin but still.",1,1,t2_3biubevd,/r/AIDungeon/comments/18vs67c/anyone_else_feel_like_they_lobotomized_griffin/,no_2nd_retrieval,[],False,,,False,billyboi356,,,[],,,,text,False,False,False,[],,,False,False,,False,,False,1704096332.0,20240101-080532,1704096332.0,,,self.AIDungeon,0,False,0,False,True,18vs67c,False,True,False,False,False,True,True,False,,#005ba1,,[],72427be6-9455-11ee-a127-aeee2d3d7133,AI News & Models,dark,text,False,,False,,,,[],True,10,0,0,False,,False,,False,,,,[],1704096353,False,1,,True,False,False,AIDungeon,t5_29uaei,r/AIDungeon,44907,public,,self,,,,0,[],1704096370,https://www.reddit.com/r/AIDungeon/comments/18vs67c/anyone_else_feel_like_they_lobotomized_griffin/,[],,False,,
t3_18vzjrw,Are there AI-centric crypto projects where I can contribute in different roles?, Are there AI-centric crypto projects where I can contribute in different roles? ,1,1,t2_ls05h,/r/AIDungeon/comments/18vzjrw/are_there_aicentric_crypto_projects_where_i_can/,no_2nd_retrieval,[],False,,,False,melissabreanne,,,[],,,,text,False,False,False,[],,,False,False,,False,,False,1704124626.0,20240101-155706,1704124626.0,,,self.AIDungeon,0,False,0,False,True,18vzjrw,False,True,False,False,False,True,True,False,,#349e48,,[],ae468a20-1ac8-11ea-af43-0effba01f5bd,Questions,dark,text,False,,False,,,,[],False,6,0,0,False,,False,,False,,,,[],1704124638,False,1,,True,False,False,AIDungeon,t5_29uaei,r/AIDungeon,44909,public,,self,,,,0,[],1704124656,https://www.reddit.com/r/AIDungeon/comments/18vzjrw/are_there_aicentric_crypto_projects_where_i_can/,[],,False,,
t3_18w68lh,Saving Image Style,"Is there any way to save the ""Image Style"" seasonings globally? Right now it seems like I have to type them in again every time I start a new adventure. My favorite set right now consists of 10 tags, so it's a  lot to type. I end up starting every session by continuing an old adventure, copying the image style, then starting a new one and pasting it in.

(Incidentally, any update on improving the image filter? The dev team mentioned about a year ago that they were working on it, but I don't see any mention of it since. I still sometimes get failed requests for images that should be innocuous.)",1,1.0,t2_61ms2,/r/AIDungeon/comments/18w68lh/saving_image_style/,no_2nd_retrieval,[],False,,,False,MindWandererB,,,[],,,,text,False,False,False,[],,,False,False,,False,,False,1704141949.0,20240101-204549,1704141949.0,,,self.AIDungeon,0,False,0,False,True,18w68lh,False,True,False,False,False,True,True,False,,#349e48,,[],ae468a20-1ac8-11ea-af43-0effba01f5bd,Questions,dark,text,False,,False,,,,[],True,0,0,0,False,,False,,False,,,,[],1704141964,False,1,,True,False,False,AIDungeon,t5_29uaei,r/AIDungeon,44910,public,,self,,,,0,[],1704141980,https://www.reddit.com/r/AIDungeon/comments/18w68lh/saving_image_style/,[],,False,,
t3_18w7og3,"Lmao. So my character is looking for any information about this crystal, but suddenly already has crystal itself and gives it in exchange for some worn-out map. Genius.",,1,1.0,t2_vmnf2yos,/r/AIDungeon/comments/18w7og3/lmao_so_my_character_is_looking_for_any/,no_2nd_retrieval,[],False,,,False,International-Ask388,,,[],,,,text,False,False,False,[],,,False,False,,False,,False,1704145548.0,20240101-214548,1704145548.0,,,i.redd.it,0,False,0,False,True,18w7og3,False,True,False,False,True,True,False,False,,#00a6a5,,[],a23d301c-1ac8-11ea-8ec5-0e528b1d55b5,Adventures & Excerpts,dark,text,False,,False,,,,[],False,6,0,0,False,,False,image,True,"[{""id"": ""bEYupUmC355coZk-WJkzaNHZ906k6usHlVe1Bk29yck"", ""resolutions"": [{""height"": 33, ""url"": ""https://preview.redd.it/21fwy72idw9c1.png?width=108&crop=smart&auto=webp&s=aefb05b6b9c9effc363b492b771553308cea2ba8"", ""width"": 108}, {""height"": 67, ""url"": ""https://preview.redd.it/21fwy72idw9c1.png?width=216&crop=smart&auto=webp&s=fa8b191cb6c44d742915b6dd47da510f10e87fb2"", ""width"": 216}, {""height"": 100, ""url"": ""https://preview.redd.it/21fwy72idw9c1.png?width=320&crop=smart&auto=webp&s=135e8fe4b243fa6a5b884a8b65f6c967c74a2ff6"", ""width"": 320}, {""height"": 201, ""url"": ""https://preview.redd.it/21fwy72idw9c1.png?width=640&crop=smart&auto=webp&s=54653643ac9ac194205f1362bed06425880515d6"", ""width"": 640}, {""height"": 302, ""url"": ""https://preview.redd.it/21fwy72idw9c1.png?width=960&crop=smart&auto=webp&s=e7c32c6ef17680a631230e9f04e4525ca32a52ca"", ""width"": 960}], ""source"": {""height"": 308, ""url"": ""https://preview.redd.it/21fwy72idw9c1.png?auto=webp&s=cf55920fb57be7a4b9bd1ed8d9c1213dde1c7589"", ""width"": 979}, ""variants"": {}}]",,False,,,,[],1704145565,False,1,,True,False,False,AIDungeon,t5_29uaei,r/AIDungeon,44911,public,,https://b.thumbs.redditmedia.com/cplNLZplYmoJzgirV1UZe5JXKjgCjOa0nJyZkn1STls.jpg,44,140,,0,[],1704145579,https://i.redd.it/21fwy72idw9c1.png,https://i.redd.it/21fwy72idw9c1.png,[],,False,,
t3_18wbfi6,Phoenix is trash for users with dyslexia and other disability issues.,"Retiring Legacy instead of just making it the default again was a terrible choice because it lacks readability,sanity, and efficiency. 

Like Phoenix just randomly assigning images to stories? Annoying as hell and it's not as if we can turn it off or limit what images we pick. So Suddenly there's Horror images on sexual nsfw where no one asked for an exposed skull on a zombie. Suddenly horror stuff has some random cozy scene. 

Then there's the fact we've ended up with less control over font size and fonts. Large isn't Large enough but Max is too big.  None of the 3 fonts given are dyslexia friendly.  The formatting sucks now and refuses to let me break up the stories properly. 

The disappearance of buttons and information ensuring they're not always on screen makes actually doing the Ai stories way harder. Legacy actively had easy to understand buttons explaining exactly what they were for and having every function either on screen or quickly accessible.   


What is the point of hiding duplicate and other commonly used options in a menu? What is the point of removing the 3 dots when you click a specific part of the story making it so it's a blank thing that doesn't give you any information?  What is the point of hiding where you typed at all when that's the whole point of having Ai Dungeon? 

The Menus are a nightmare making it frustrating to go anywhere in the site and the lack of pagination means now the site eats up way more memory than it needs to just harming the devices.  

Phoenix is terrible for PC users. I know a lot of web developers and management are making the dumb choice not to separate PC and mobile into their own interfaces and instead making one subpar UI and it just feels like this is the same terrible choice being made here. 

And hiding people's feedback in discord where people can't access it without an account on a seprate platform is also trash. Specially when we all know people use the site for nsfw that they don't feel comfortable letting people get even the inkling they might be doing. 

At this point I need people to ether bring back legacy in someway officially or unofficially or I'm going to have to abandon something I've been having fun with for years. ",1,1,t2_5g42a2av,/r/AIDungeon/comments/18wbfi6/phoenix_is_trash_for_users_with_dyslexia_and/,no_2nd_retrieval,[],False,,,False,NormalTouch,,,[],,,,text,False,False,False,[],,,False,False,,False,,False,1704155190.0,20240102-002630,1704155190.0,,,self.AIDungeon,0,False,0,False,True,18wbfi6,False,True,False,False,False,True,True,False,,#d3d6da,,[],13d866b0-1ace-11ea-b995-0e2090029281,Disabilty issues,dark,text,False,,False,,,,[],True,3,0,0,False,,False,,,,,False,,,,[],1704155208,False,1,,True,False,False,AIDungeon,t5_29uaei,r/AIDungeon,44912,public,,self,,,,0,[],1704155224,https://www.reddit.com/r/AIDungeon/comments/18wbfi6/phoenix_is_trash_for_users_with_dyslexia_and/,,[],,False,,
t3_18wim6d,I made this as a joke about how much AI Dungeon sanitises anything you put through it,"I once made a world based on the Late Eighth Century to Early Ninth Century in the North Sea, aka the Early Viking Age, it had mythological Elements but it was meant to be historical Fiction first. Suddenly we had Dragons, Elves and Dwarves in Midgard, Cobolds. It was awful. This happens all the time",1,1,t2_p7mgd861,/r/AIDungeon/comments/18wim6d/i_made_this_as_a_joke_about_how_much_ai_dungeon/,no_2nd_retrieval,[],False,,,False,Bobertbobthebobth69,,,[],,,,text,False,False,False,[],,,False,False,,False,,False,1704176534.0,20240102-062214,1704176534.0,,,i.redd.it,0,False,0,False,True,18wim6d,False,True,False,False,True,True,False,False,,#007373,,[],3edd3e2c-9382-11ee-b76f-96885a514cbe,Scenario,light,text,False,,False,,,,[],False,13,0,0,False,,False,image,True,"[{""id"": ""UhmYCvmM_VGCJ1MWc64Ma2u-OervgRFT71vOMzQW11M"", ""resolutions"": [{""height"": 97, ""url"": ""https://preview.redd.it/fjybszcszy9c1.jpeg?width=108&crop=smart&auto=webp&s=701135e26983f0f91161f57c901457e4d0e011dd"", ""width"": 108}, {""height"": 194, ""url"": ""https://preview.redd.it/fjybszcszy9c1.jpeg?width=216&crop=smart&auto=webp&s=0ce4ff9b4b5620de7933372740db7e3abb91438a"", ""width"": 216}, {""height"": 288, ""url"": ""https://preview.redd.it/fjybszcszy9c1.jpeg?width=320&crop=smart&auto=webp&s=85713f47001092d6e75ce20ceeaf0def8d3b14ca"", ""width"": 320}, {""height"": 577, ""url"": ""https://preview.redd.it/fjybszcszy9c1.jpeg?width=640&crop=smart&auto=webp&s=b1384c2796ea3c4a28fc3cf7ac503387f85a7333"", ""width"": 640}], ""source"": {""height"": 677, ""url"": ""https://preview.redd.it/fjybszcszy9c1.jpeg?auto=webp&s=47f6a37a4352c4d64191bb54b65e432edd9276f6"", ""width"": 750}, ""variants"": {}}]",,False,,,,[],1704176554,False,1,,True,False,False,AIDungeon,t5_29uaei,r/AIDungeon,44912,public,,https://b.thumbs.redditmedia.com/km2luJtrh_cuglyIzcn0_uYpSGeMneZhuvWq7yx6rVE.jpg,126,140,,0,[],1704176567,https://i.redd.it/fjybszcszy9c1.jpeg,https://i.redd.it/fjybszcszy9c1.jpeg,[],,False,,
t3_18wkr71,Search function for Android,"Not sure why but AiDungeon doesn't allow me to look at a story, than back button to my search request. It instead backs out all the way to main menu, forcing me to once again restart the search from scratch.

Also does not save search preferences, ""popular, trending, etc... also annoying.",1,1.0,t2_5cs78u7t,/r/AIDungeon/comments/18wkr71/search_function_for_android/,no_2nd_retrieval,[],False,,,False,Mobile-Worth2530,,,[],,,,text,False,False,False,[],,,False,False,,False,,False,1704184790.0,20240102-083950,1704184790.0,,,self.AIDungeon,0,False,0,False,True,18wkr71,False,True,False,False,False,True,True,False,,#5a74cc,,[],fb19276e-9381-11ee-9eaa-2ab21dc32b0a,Bug Report,light,text,False,,False,,,,[],False,0,0,0,False,,False,,,,,False,,,,[],1704184805,False,1,,True,False,False,AIDungeon,t5_29uaei,r/AIDungeon,44913,public,,self,,,,0,[],1704184820,https://www.reddit.com/r/AIDungeon/comments/18wkr71/search_function_for_android/,,[],,False,,
t3_18wl49p,Various presets,"I have seen tons, of requests from newer users about doing X. Why not make sample presets, based off the best examples built straight into the UI to give people some place to start messing around with creating their adventures.

Yeah I know, there is no best way, some people find other ways, but I know the creators had to test ""Something"" to figure out what works and what doesn't.

Example: A/N

Write a fantasy story with narrative verbose, vivid prose and descriptions that invoke all senses.

I've personally had great results with that but maybe there is a way better. I'm sure there is, instead of having to immediately run to discord had there been a preset someone could mess with. They could advance faster because they have something to start with vs looking at other people's stories and learning by trail and error. I'll be honest, I went to NAI spots to learn stuff, there wasn't enough AiDungeon stuff and it produced better results faster.

The other feature in story cards could offer a sample template. I personally have found JSON to be the best method with an added [ bracket] small description for characters. And then freeing up memory for what the adventure current events vs putting into A/N.

Yet again there may be a better way to even that and I don't realize it. Casual players aren't going to go the extra mile... Their just going to say it sucks and bounce without ever realizing they were one step away from getting what they wanted.

Guess my rant is done, my 2 cents...",1,1.0,t2_5cs78u7t,/r/AIDungeon/comments/18wl49p/various_presets/,no_2nd_retrieval,[],False,,,False,Mobile-Worth2530,,,[],,,,text,False,False,False,[],,,False,False,,False,,False,1704186258.0,20240102-090418,1704186258.0,,,self.AIDungeon,0,False,0,False,True,18wl49p,False,True,False,False,False,True,True,False,,#005ba1,,[],ab2df5da-1ac8-11ea-9c1c-0e4df316c103,Feedback & Requests,light,text,False,,False,,,,[],True,0,0,0,False,,False,,,,,False,,,,[],1704186273,False,1,,True,False,False,AIDungeon,t5_29uaei,r/AIDungeon,44913,public,,self,,,,0,[],1704186294,https://www.reddit.com/r/AIDungeon/comments/18wl49p/various_presets/,,[],,False,,
t3_18wm2hm,Random dialogue reminded me of this key and peele sketch,"“I just had the best dream!"" You raise an eyebrow, intrigued by the way her eyes light up with excitement. ""What was it about?"" you ask, curious. She shrugs, ""I don't know, I just felt like I could fly,"" she says. You smile.
""Well, that sounds amazing. You should definitely try it sometime.""
",1,1,t2_97s1saty,/r/AIDungeon/comments/18wm2hm/random_dialogue_reminded_me_of_this_key_and_peele/,no_2nd_retrieval,[],False,,,False,Most-Environment-214,,,[],,,dark,text,False,False,False,[],,,False,False,,False,,False,1704190151.0,20240102-100911,1704190151.0,,,v.redd.it,0,False,0,False,True,18wm2hm,False,True,False,False,True,True,False,True,,#00a6a5,,[],a23d301c-1ac8-11ea-8ec5-0e528b1d55b5,Adventures & Excerpts,dark,text,False,,False,2400,https://v.redd.it/bftenkl940ac1/DASHPlaylist.mpd?a=1706782166%2CNTkzNGUxZDkwYTU0N2JjOTI2NjUwOTk0NzY1MTg1NWExZThkMzg0NGFmZjYxZDI4ZjE4ZmM4Yzg0MDE0OThlZQ%3D%3D&v=1&f=sd,27,https://v.redd.it/bftenkl940ac1/DASH_720.mp4?source=fallback,True,592,https://v.redd.it/bftenkl940ac1/HLSPlaylist.m3u8?a=1706782166%2CNWYxYjBjYzZjNGMzYzIwNmRmNDdiN2IwMTQwMzhkOTMzNGU4NDRjMGVlODBiNGQyOTQ4ZDk2MGI5ZmI4ZDc3Zg%3D%3D&v=1&f=sd,False,https://v.redd.it/bftenkl940ac1/DASH_96.mp4,completed,1280,,,,[],True,0,0,0,False,,False,hosted:video,False,"[{""id"": ""Y3d0MnAxajk0MGFjMcs7XWY-kM4nzpGdDfpyzAXOtjB4KlF9waYUSG5hXz5g"", ""resolutions"": [{""height"": 49, ""url"": ""https://external-preview.redd.it/Y3d0MnAxajk0MGFjMcs7XWY-kM4nzpGdDfpyzAXOtjB4KlF9waYUSG5hXz5g.png?width=108&crop=smart&format=pjpg&auto=webp&s=068cd6c796ef3867dace3cdb992c50338259a962"", ""width"": 108}, {""height"": 99, ""url"": ""https://external-preview.redd.it/Y3d0MnAxajk0MGFjMcs7XWY-kM4nzpGdDfpyzAXOtjB4KlF9waYUSG5hXz5g.png?width=216&crop=smart&format=pjpg&auto=webp&s=f2f5024917376b440e327a47eadd1baecaf04f9a"", ""width"": 216}, {""height"": 148, ""url"": ""https://external-preview.redd.it/Y3d0MnAxajk0MGFjMcs7XWY-kM4nzpGdDfpyzAXOtjB4KlF9waYUSG5hXz5g.png?width=320&crop=smart&format=pjpg&auto=webp&s=60377aca5335b233d8ddde639efd940b5d85a4ff"", ""width"": 320}, {""height"": 296, ""url"": ""https://external-preview.redd.it/Y3d0MnAxajk0MGFjMcs7XWY-kM4nzpGdDfpyzAXOtjB4KlF9waYUSG5hXz5g.png?width=640&crop=smart&format=pjpg&auto=webp&s=047eed6e96ec5ea2743e0fa2dd4ba24a06497a43"", ""width"": 640}, {""height"": 444, ""url"": ""https://external-preview.redd.it/Y3d0MnAxajk0MGFjMcs7XWY-kM4nzpGdDfpyzAXOtjB4KlF9waYUSG5hXz5g.png?width=960&crop=smart&format=pjpg&auto=webp&s=e624a1d17f27c967fad877787c730385aded0961"", ""width"": 960}, {""height"": 499, ""url"": ""https://external-preview.redd.it/Y3d0MnAxajk0MGFjMcs7XWY-kM4nzpGdDfpyzAXOtjB4KlF9waYUSG5hXz5g.png?width=1080&crop=smart&format=pjpg&auto=webp&s=ee40521252e53e8d0043e3a69d54357c59812a28"", ""width"": 1080}], ""source"": {""height"": 888, ""url"": ""https://external-preview.redd.it/Y3d0MnAxajk0MGFjMcs7XWY-kM4nzpGdDfpyzAXOtjB4KlF9waYUSG5hXz5g.png?format=pjpg&auto=webp&s=8ee51211f12a01d93e22bab6b974ae1735b337ed"", ""width"": 1920}, ""variants"": {}}]",,False,,,,[],1704190168,False,1,,2400,https://v.redd.it/bftenkl940ac1/DASHPlaylist.mpd?a=1706782166%2CNTkzNGUxZDkwYTU0N2JjOTI2NjUwOTk0NzY1MTg1NWExZThkMzg0NGFmZjYxZDI4ZjE4ZmM4Yzg0MDE0OThlZQ%3D%3D&v=1&f=sd,27,https://v.redd.it/bftenkl940ac1/DASH_720.mp4?source=fallback,True,592,https://v.redd.it/bftenkl940ac1/HLSPlaylist.m3u8?a=1706782166%2CNWYxYjBjYzZjNGMzYzIwNmRmNDdiN2IwMTQwMzhkOTMzNGU4NDRjMGVlODBiNGQyOTQ4ZDk2MGI5ZmI4ZDc3Zg%3D%3D&v=1&f=sd,False,https://v.redd.it/bftenkl940ac1/DASH_96.mp4,completed,1280,True,False,False,AIDungeon,t5_29uaei,r/AIDungeon,44913,public,,"https://external-preview.redd.it/Y3d0MnAxajk0MGFjMcs7XWY-kM4nzpGdDfpyzAXOtjB4KlF9waYUSG5hXz5g.png?width=140&height=64&crop=140:64,smart&format=jpg&v=enabled&lthumb=true&s=842e6f3b0f7354a4954d497dd0c19f2241c4a1fe",64,140,,0,[],1704190185,https://v.redd.it/bftenkl940ac1,https://v.redd.it/bftenkl940ac1,[],,False,,
t3_18wxsk4,Mixtral Server Optimization,"Thanks to all of you who have been testing our new models, Mixtral and MythoMax, while they’ve been in Early Access.

We’re starting to test a server optimization for Mixtral. This change should have no impact on the model's performance or quality. 

This will begin as a 50/50 split test. The new Mixtral version will be displayed as another version, and half of players with Mixtral selected as their model will be directed to the new version.

We’ll monitor for any issues. If there are any, we’ll roll back the change. If the new change performs as expected, we’ll migrate all players to the new version after testing.",1,1,t2_ugspbkxi,/r/AIDungeon/comments/18wxsk4/mixtral_server_optimization/,no_2nd_retrieval,[],False,,,False,latitude_official,#ffb000,,[],12abe60c-938a-11ee-8572-8ad099769095,Official Account,dark,text,False,False,False,[],,,False,False,,False,,False,1704223495.0,20240102-192455,1704223495.0,,,self.AIDungeon,0,False,0,False,True,18wxsk4,False,True,False,False,False,True,True,False,,,,[],,,dark,text,False,,False,,,,,,,,,,,,,,,[],True,0,0,0,False,,False,,,,,False,,,,[],1704223513,False,1,,,,,,,,,,,,,True,False,False,AIDungeon,t5_29uaei,r/AIDungeon,44916,public,,self,,,,0,[],1704223527,https://www.reddit.com/r/AIDungeon/comments/18wxsk4/mixtral_server_optimization/,,[],,False,,
t3_18wxsuv,Mixtral Server Optimization,"Thanks to all of you who have been testing our new models, Mixtral and MythoMax, while they’ve been in Early Access.

We’re starting to test a server optimization for Mixtral. This change should have no impact on the model's performance or quality. 

This will begin as a 50/50 split test. The new Mixtral version will be displayed as another version, and half of players with Mixtral selected as their model will be directed to the new version.

We’ll monitor for any issues. If there are any, we’ll roll back the change. If the new change performs as expected, we’ll migrate all players to the new version after testing.",1,1,t2_ugspbkxi,/r/AIDungeon/comments/18wxsuv/mixtral_server_optimization/,no_2nd_retrieval,[],False,,,False,latitude_official,#ffb000,,[],12abe60c-938a-11ee-8572-8ad099769095,Official Account,dark,text,False,False,False,[],,,False,False,,False,,False,1704223514.0,20240102-192514,1704223514.0,,,self.AIDungeon,0,False,0,False,True,18wxsuv,False,True,False,False,False,True,True,False,,#ab912b,,[],1934a3e4-9455-11ee-80d9-1aaef3318f5f,Progress Updates,dark,text,False,,False,,,,,,,,,,,,,,,[],False,0,0,0,False,,False,,,,,False,,,,[],1704223529,False,1,,,,,,,,,,,,,True,False,False,AIDungeon,t5_29uaei,r/AIDungeon,44916,public,,self,,,,0,[],1704223548,https://www.reddit.com/r/AIDungeon/comments/18wxsuv/mixtral_server_optimization/,,[],,False,,
t3_18wyevr,"Where did the ""pin"" option go in Phoenix?","I often made use of the pin option to help the AI remember context, but it seems absent from the Phoenix update.",1,1,t2_amh1h,/r/AIDungeon/comments/18wyevr/where_did_the_pin_option_go_in_phoenix/,no_2nd_retrieval,[],False,,,False,ExplodingSatan,,,[],,,,text,False,False,False,[],,,False,False,,False,,False,1704224988.0,20240102-194948,1704224988.0,,,self.AIDungeon,0,False,0,False,True,18wyevr,False,True,False,False,False,True,True,False,,#349e48,,[],ae468a20-1ac8-11ea-af43-0effba01f5bd,Questions,dark,text,False,,False,,,,,,,,,,,,,,,[],True,3,0,0,False,,False,,,,,False,,,,[],1704225007,False,1,,,,,,,,,,,,,True,False,False,AIDungeon,t5_29uaei,r/AIDungeon,44917,public,,self,,,,0,[],1704225024,https://www.reddit.com/r/AIDungeon/comments/18wyevr/where_did_the_pin_option_go_in_phoenix/,,[],,False,,
